id,categoryCode,commonCode,categoryCommonCodeNm,commonCodeNm,commonValue,commonCodeSNO,commonUseFl,version,description,syntax,param,example,descriptionEn,paramEn,exampleEn
63,PAGE-CALCULATION,STRING,STRING FIELD,STRING FUNCTION,UPPER,1,Y,0,"텍스트 문자열을 모두 대문자로 바꿉니다.","UPPER(text)","text: 대문자로 바꾸려는 텍스트입니다.","UPPER('abc') = <span class=\"ddp-txt-sub-det\">'ABC'</span>#UPPER('Abc') = <span class=\"ddp-txt-sub-det\">'ABC'</span>#UPPER('ABC') = <span class=\"ddp-txt-sub-det\">'ABC'</span>","Capitalize all text strings.","text: Text to replace with a capital letter.","UPPER('abc') = <span class=\"ddp-txt-sub-det\">'ABC'</span>#UPPER('Abc') = <span class=\"ddp-txt-sub-det\">'ABC'</span>#UPPER('ABC') = <span class=\"ddp-txt-sub-det\">'ABC'</span>"
64,PAGE-CALCULATION,STRING,STRING FIELD,STRING FUNCTION,LOWER,1,Y,0,"텍스트 문자열의 모든 문자를 소문자로 변환합니다.","LOWER(text)","text: 소문자로 바꾸려는 텍스트입니다. 문자가 아닌 경우는 변환되지 않습니다.","LOWER('abc') = <span class=\"ddp-txt-sub-det\">'abc'</span>#LOWER('Abc') = <span class=\"ddp-txt-sub-det\">'abc'</span>#LOWER('ABC') = <span class=\"ddp-txt-sub-det\">'abc'</span>","Converts all characters in a text string to lowercase.","text: Text to replace with lowercase letters. If it is not a character, it will not be converted.","LOWER('abc') = <span class=\"ddp-txt-sub-det\">'abc'</span>#LOWER('Abc') = <span class=\"ddp-txt-sub-det\">'abc'</span>#LOWER('ABC') = <span class=\"ddp-txt-sub-det\">'abc'</span>"
65,PAGE-CALCULATION,STRING,STRING FIELD,STRING FUNCTION,SPLIT,1,Y,0,"특정 분리자로 문자열을 분리하여 지정된 위치의 문자열을 반환합니다.","SPLIT(text, delimitor, index)","text: 대상이 되는 문자열입니다.#delimitor: 문자열을 분해하고자 하는 분리자입니다.#index: 반환하고자 하는 분해된 문자열의 위치입니다.","SPLIT('first:second', ':', 0) = <span class=\"ddp-txt-sub-det\">'first'</span>#SPLIT('first:second', ':', 1) = <span class=\"ddp-txt-sub-det\">'second'</span>#SPLIT('first:second', ':', 2) = <span class=\"ddp-txt-sub-det\">null</span>#SPLIT('first:second', ',', 0) = <span class=\"ddp-txt-sub-det\">'first:second'</span>","Returns a string at a specified location by separating the string with a specific separator.","text: The string to be targeted.#delimitor: Is the separator where you want to break down the string.#index: The location of the disassembled string that you want to return.","SPLIT('first:second', ':', 0) = <span class=\"ddp-txt-sub-det\">'first'</span>#SPLIT('first:second', ':', 1) = <span class=\"ddp-txt-sub-det\">'second'</span>#SPLIT('first:second', ':', 2) = <span class=\"ddp-txt-sub-det\">null</span>#SPLIT('first:second', ',', 0) = <span class=\"ddp-txt-sub-det\">'first:second'</span>"
66,PAGE-CALCULATION,STRING,STRING FIELD,STRING FUNCTION,SPLITREGEX,1,Y,0,"특정 분리자(정규표현식)로 문자열을 분리하여 지정된 위치의 문자열을 반환합니다.","SPLITREGEX(text, delimitor, index)","text: 대상이 되는 문자열입니다.#delimitor: 문자열을 분해하고자 하는 정규표현식으로 표현된 분리자입니다.#index: 반환하고자 하는 분해된 문자열의 위치입니다.","SPLITREGEX('first/second', '\/', 0) = <span class=\"ddp-txt-sub-det\">'first'</span>#SPLITREGEX('first/second', '\/', 1) = <span class=\"ddp-txt-sub-det\">'second'</span>#SPLITREGEX('first/second', '\/', 2) = <span class=\"ddp-txt-sub-det\">null</span>#SPLITREGEX('first/second', ',', 0) = <span class=\"ddp-txt-sub-det\">'first/second'</span>","Returns a string at a specified location by separating the string with a specific separator (regular expression).","text: The string to be targeted.#delimitor: Separator expressed as a regular expression to break down the string.#index: The location of the disassembled string that you want to return.","SPLITREGEX('first/second', '\/', 0) = <span class=\"ddp-txt-sub-det\">'first'</span>#SPLITREGEX('first/second', '\/', 1) = <span class=\"ddp-txt-sub-det\">'second'</span>#SPLITREGEX('first/second', '\/', 2) = <span class=\"ddp-txt-sub-det\">null</span>#SPLITREGEX('first/second', ',', 0) = <span class=\"ddp-txt-sub-det\">'first/second'</span>"
67,PAGE-CALCULATION,STRING,STRING FIELD,STRING FUNCTION,PROPER,1,Y,0,"각 단어의 첫째 문자를 대문자로 변환하고 나머지 문자는 소문자로 변환합니다.","PROPER(text)","text: 대상이 되는 문자열입니다.","PROPER('abc') = <span class=\"ddp-txt-sub-det\">'Abc'</span>#PROPER('ABC') = <span class=\"ddp-txt-sub-det\">'Abc'</span>#PROPER('123') = <span class=\"ddp-txt-sub-det\">'123'</span>#PROPER('') = <span class=\"ddp-txt-sub-det\">''</span>","Convert the first letter of each word to uppercase and the rest to lowercase.","text: The string to be targeted.","PROPER('abc') = <span class=\"ddp-txt-sub-det\">'Abc'</span>#PROPER('ABC') = <span class=\"ddp-txt-sub-det\">'Abc'</span>#PROPER('123') = <span class=\"ddp-txt-sub-det\">'123'</span>#PROPER('') = <span class=\"ddp-txt-sub-det\">''</span>"
68,PAGE-CALCULATION,STRING,STRING FIELD,STRING FUNCTION,LENGTH,1,Y,0,"텍스트 문자열 내의 문자 개수를 구합니다.","LENGTH(text)","text: 사용자가 찾는 개수의 문자가 들어 있는 텍스트입니다. 공백도 문자 개수에 포함됩니다.","LENGTH('abc') = <span class=\"ddp-txt-sub-det\">3</span>#LENGTH('') = <span class=\"ddp-txt-sub-det\">0</span>#LENGTH('123 abc') = <span class=\"ddp-txt-sub-det\">7</span>","Gets the number of characters in the text string.","text: Text that contains the number of characters you are looking for. Spaces are also included in the number of characters.","LENGTH('abc') = <span class=\"ddp-txt-sub-det\">3</span>#LENGTH('') = <span class=\"ddp-txt-sub-det\">0</span>#LENGTH('123 abc') = <span class=\"ddp-txt-sub-det\">7</span>"
69,PAGE-CALCULATION,STRING,STRING FIELD,STRING FUNCTION,STRLEN,1,Y,0,"텍스트 문자열 내의 문자 개수를 구합니다.","STRLEN(text)","text: 사용자가 찾는 개수의 문자가 들어 있는 텍스트입니다. 공백도 문자 개수에 포함됩니다.","STRLEN('abc') = <span class=\"ddp-txt-sub-det\">3</span>#STRLEN('') = <span class=\"ddp-txt-sub-det\">0</span>#STRLEN('123 abc') = <span class=\"ddp-txt-sub-det\">7</span>","Gets the number of characters in the text string.","text: Text that contains the number of characters you are looking for. Spaces are also included in the number of characters.","STRLEN('abc') = <span class=\"ddp-txt-sub-det\">3</span>#STRLEN('') = <span class=\"ddp-txt-sub-det\">0</span>#STRLEN('123 abc') = <span class=\"ddp-txt-sub-det\">7</span>"
70,PAGE-CALCULATION,STRING,STRING FIELD,STRING FUNCTION,LEFT,1,Y,0,"텍스트 문자열의 시작 지점부터 지정한 수만큼의 문자를 반환합니다.","LEFT(text, num_chars)","text: 추출하려는 문자가 들어 있는 텍스트 문자열입니다.#num_chars: 왼쪽(LEFT)부터 추출할 문자 수를 지정합니다.","LEFT('abcdefg', 3) = <span class=\"ddp-txt-sub-det\">'abc'</span>#LEFT('abc', 5) = <span class=\"ddp-txt-sub-det\">'abc'</span>#LEFT('123 abc', 5) = <span class=\"ddp-txt-sub-det\">'123 a'</span>","Returns the specified number of characters from the start point of the text string.","text: Text string containing the characters you want to extract.#num_chars: Specifies the number of characters to extract from the left (LEFT).","LEFT('abcdefg', 3) = <span class=\"ddp-txt-sub-det\">'abc'</span>#LEFT('abc', 5) = <span class=\"ddp-txt-sub-det\">'abc'</span>#LEFT('123 abc', 5) = <span class=\"ddp-txt-sub-det\">'123 a'</span>"
71,PAGE-CALCULATION,STRING,STRING FIELD,STRING FUNCTION,RIGHT,1,Y,0,"텍스트 문자열의 끝 지점부터 지정한 수만큼의 문자를 반환합니다.","RIGHT(text, num_chars)","text: 추출하려는 문자가 들어 있는 텍스트 문자열입니다.#num_chars: 추출할 문자 수를 지정합니다.","RIGHT('abcdefg', 3) = <span class=\"ddp-txt-sub-det\">'efg'</span>#RIGHT('abc', 5) = <span class=\"ddp-txt-sub-det\">'abc'</span>#RIGHT('123 abc', 5) = <span class=\"ddp-txt-sub-det\">'3 abc'</span>","Returns the specified number of characters from the end point of the text string.","text: Text string containing the characters you want to extract.#num_chars: Specifies the number of characters to extract.","RIGHT('abcdefg', 3) = <span class=\"ddp-txt-sub-det\">'efg'</span>#RIGHT('abc', 5) = <span class=\"ddp-txt-sub-det\">'abc'</span>#RIGHT('123 abc', 5) = <span class=\"ddp-txt-sub-det\">'3 abc'</span>"
72,PAGE-CALCULATION,STRING,STRING FIELD,STRING FUNCTION,MID,1,Y,0,"시작 위치 및 마지막 위치가 지정된 텍스트 문자열의 중간 부분에서 문자를 반환합니다.","MID(text, start_num, end_num)","text: 문자를 추출할 텍스트 문자열입니다.#start_num: 추출할 첫 문자의 위치입니다. 텍스트에서 첫 문자는 0이 됩니다.#end_num: 추출할 마지막 문자의 다음 위치입니다.","MID('abcdefg', 1, 5) = <span class=\"ddp-txt-sub-det\">'bcde'</span>#MID('abc', 2, 3) = <span class=\"ddp-txt-sub-det\">'c'</span>#MID('123 abc', 4, 4) = <span class=\"ddp-txt-sub-det\">''</span>","The start and last position return characters from the middle of the specified text string.","text: Text string to extract characters from.#start_num: Location of the first character to be extracted. The first letter in the text will be zero.#end_num: The next location for the last character to be extracted.","MID('abcdefg', 1, 5) = <span class=\"ddp-txt-sub-det\">'bcde'</span>#MID('abc', 2, 3) = <span class=\"ddp-txt-sub-det\">'c'</span>#MID('123 abc', 4, 4) = <span class=\"ddp-txt-sub-det\">''</span>"
73,PAGE-CALCULATION,STRING,STRING FIELD,STRING FUNCTION,SUBSTRING,1,Y,0,"시작 위치에서 지정한 길이만큼을 지정된 텍스트 문자열의 중간 부분에서 문자를 반환합니다.","SUBSTRING(text, start_num, length)","text: 문자를 추출할 텍스트 문자열입니다.#start_num: 추출할 첫 문자의 위치입니다. 텍스트에서 첫 문자는 0이 됩니다.#length: 추출할 문자열의 길이입니다.","SUBSTRING('abcdefg', 1, 5) = <span class=\"ddp-txt-sub-det\">'bcde'</span>#SUBSTRING('abc', 2, 3) = <span class=\"ddp-txt-sub-det\">'c'</span>#SUBSTRING('123 abc', 4, 4) = <span class=\"ddp-txt-sub-det\">''</span>","Returns a character from the middle of the specified text string for the length specified in the start position.","text: Text string to extract characters from.#start_num: Location of the first character to be extracted. The first letter in the text will be zero.#length: length of string to extract.","SUBSTRING('abcdefg', 1, 5) = <span class=\"ddp-txt-sub-det\">'bcde'</span>#SUBSTRING('abc', 2, 3) = <span class=\"ddp-txt-sub-det\">'c'</span>#SUBSTRING('123 abc', 4, 4) = <span class=\"ddp-txt-sub-det\">''</span>"
74,PAGE-CALCULATION,STRING,STRING FIELD,STRING FUNCTION,INDEXOF,1,Y,0,"텍스트 문자열에서 지정된 문자열을 찾아 그 위치를 반환합니다.","INDEXOF(text, find_text)","text: 대상이 되는 텍스트 문자열입니다.#find_text: 찾고자하는 텍스트 문자열입니다.","INDEXOF('abcdefg', 'cde') = <span class=\"ddp-txt-sub-det\">2</span>#INDEXOF('abcdefg', 'bdf') = <span class=\"ddp-txt-sub-det\">-1</span>#INDEXOF('123 abc', '3 a') = <span class=\"ddp-txt-sub-det\">2</span>","Finds the specified string in the text string and returns its location.","text: The text string to which it is targeted.#find_text: The text string you want to find.","INDEXOF('abcdefg', 'cde') = <span class=\"ddp-txt-sub-det\">2</span>#INDEXOF('abcdefg', 'bdf') = <span class=\"ddp-txt-sub-det\">-1</span>#INDEXOF('123 abc', '3 a') = <span class=\"ddp-txt-sub-det\">2</span>"
75,PAGE-CALCULATION,STRING,STRING FIELD,STRING FUNCTION,REPLACE,1,Y,0,"텍스트 문자열에서 지정된 문자열을 찾아 다른 문자열로 치환합니다.","REPLACE(text, find_text, replace_text)","text: 대상이 되는 텍스트 문자열입니다.#find_text: 찾고자하는 텍스트 문자열입니다.","REPLACE('abcdefg', 'cde', '-') = <span class=\"ddp-txt-sub-det\">'ab-fg'</span>#REPLACE('abcdefg', 'bdf', '-') = <span class=\"ddp-txt-sub-det\">'abcdefg'</span>#REPLACE('1 2 3', ' ', ' AND ') = <span class=\"ddp-txt-sub-det\">'1 AND 2 AND 3'</span>","Finds the specified string in the text string and replaces it with another string.","text: The text string to which it is targeted.#find_text: The text string you want to find.","REPLACE('abcdefg', 'cde', '-') = <span class=\"ddp-txt-sub-det\">'ab-fg'</span>#REPLACE('abcdefg', 'bdf', '-') = <span class=\"ddp-txt-sub-det\">'abcdefg'</span>#REPLACE('1 2 3', ' ', ' AND ') = <span class=\"ddp-txt-sub-det\">'1 AND 2 AND 3'</span>"
76,PAGE-CALCULATION,STRING,STRING FIELD,STRING FUNCTION,TRIM,1,Y,0,"단어 사이에 들어간 공백 하나를 제외하고 텍스트 문자열에서 모든 공백을 제거합니다.","TRIM(text)","text: 공백을 제거하려는 텍스트입니다.","TRIM(' abc') = <span class=\"ddp-txt-sub-det\">'abc'</span>#TRIM('abc ') = <span class=\"ddp-txt-sub-det\">'abc'</span>#TRIM(' a b c ') = <span class=\"ddp-txt-sub-det\">'a b c'</span>","Remove all spaces from the text string except for one space that is entered between words.","text: Text to remove spaces.","TRIM(' abc') = <span class=\"ddp-txt-sub-det\">'abc'</span>#TRIM('abc ') = <span class=\"ddp-txt-sub-det\">'abc'</span>#TRIM(' a b c ') = <span class=\"ddp-txt-sub-det\">'a b c'</span>"
77,PAGE-CALCULATION,STRING,STRING FIELD,STRING FUNCTION,BTRIM,1,Y,0,"대상 문자열에서 왼쪽, 오른쪽에 있는 공백 혹은 제거할 문자열을 제거하여 반환합니다.","BTRIM(text)#BTRIM(text, strip)","text: 공백을 제거하려는 텍스트입니다.#strip: 제거할 문자열입니다.","BTRIM(' abc') = <span class=\"ddp-txt-sub-det\">'abc'</span>#BTRIM('abc ') = <span class=\"ddp-txt-sub-det\">'abc'</span>#BTRIM('abc123abc','abc') = <span class=\"ddp-txt-sub-det\">'123'</span>","Returns by removing the left, right, or left space from the destination string or the string to be removed.","text: Text to remove spaces.#strip: String to remove.","BTRIM(' abc') = <span class=\"ddp-txt-sub-det\">'abc'</span>#BTRIM('abc ') = <span class=\"ddp-txt-sub-det\">'abc'</span>#BTRIM('abc123abc','abc') = <span class=\"ddp-txt-sub-det\">'123'</span>"
78,PAGE-CALCULATION,STRING,STRING FIELD,STRING FUNCTION,LTRIM,1,Y,0,"대상 문자열에서 왼쪽에 있는 공백 혹은 제거할 문자열을 제거하여 반환합니다.","LTRIM(text)#LTRIM(text, strip)","text: 공백을 제거하려는 텍스트입니다.#strip: 제거할 문자열입니다.","LTRIM(' abc') = <span class=\"ddp-txt-sub-det\">'abc'</span>#LTRIM('abc ') = <span class=\"ddp-txt-sub-det\">'abc '</span>#LTRIM('abc123abc','abc') = <span class=\"ddp-txt-sub-det\">'123abc'</span>","Returns by removing the space on the left or the string you want to remove from the destination string.","text: Text to remove spaces.#strip: String to remove.","LTRIM(' abc') = <span class=\"ddp-txt-sub-det\">'abc'</span>#LTRIM('abc ') = <span class=\"ddp-txt-sub-det\">'abc '</span>#LTRIM('abc123abc','abc') = <span class=\"ddp-txt-sub-det\">'123abc'</span>"
79,PAGE-CALCULATION,STRING,STRING FIELD,STRING FUNCTION,RTRIM,1,Y,0,"대상 문자열에서 오른쪽에 있는 공백 혹은 제거할 문자열을 제거하여 반환합니다.","RTRIM(text)#RTRIM(text, strip)","text: 공백을 제거하려는 텍스트입니다.#strip: 제거할 문자열입니다.","RTRIM(' abc') = <span class=\"ddp-txt-sub-det\">' abc'</span>#RTRIM('abc ') = <span class=\"ddp-txt-sub-det\">'abc'</span>#RTRIM('abc123abc','abc') = <span class=\"ddp-txt-sub-det\">'abc123'</span>","Returns by removing the space to the right or the string to remove from the destination string.","text: Text to remove spaces.#strip: String to remove.","RTRIM(' abc') = <span class=\"ddp-txt-sub-det\">' abc'</span>#RTRIM('abc ') = <span class=\"ddp-txt-sub-det\">'abc'</span>#RTRIM('abc123abc','abc') = <span class=\"ddp-txt-sub-det\">'abc123'</span>"
82,PAGE-CALCULATION,LOGICAL,LOGICAL FIELD,LOGICAL FUNCTION,IN,1,Y,0,"첫째 입력 값이 다른 입력 값에 있는 지를 확인하여 있으면 1 없으면 0을 반환합니다.","IN(search, value1, value2,...)","search: 찾고자 하는 값입니다.#value1: value1,value2,... 비교 대상이 되는 값들입니다.","IN(10, 1, 10, 100) = <span class=\"ddp-txt-sub-det\">1</span>#IN(0, 1, 10, 100) = <span class=\"ddp-txt-sub-det\">0</span>#IN('abc', '123', 'abc', 'efg', '456') = <span class=\"ddp-txt-sub-det\">1</span>","If the first input value is checked to see if it is in another input value, return zero if it does not exist.","search: The value you want to find.#value1: value1,value2,... Values to be compared.","IN(10, 1, 10, 100) = <span class=\"ddp-txt-sub-det\">1</span>#IN(0, 1, 10, 100) = <span class=\"ddp-txt-sub-det\">0</span>#IN('abc', '123', 'abc', 'efg', '456') = <span class=\"ddp-txt-sub-det\">1</span>"
83,PAGE-CALCULATION,LOGICAL,LOGICAL FIELD,LOGICAL FUNCTION,BETWEEN,1,Y,0,"첫째 입력 값이 범위에 속하는지를 확인하여 있으면 1 없으면 0을 반환합니다.","BETWEEN(search, start_value, end_value)","search: 찾고자 하는 값입니다.#start_value: 비교 범위의 시작이 되는 값입니다.#end_value: 비교 범위의 끝이 되는 값입니다.","BETWEEN(10, 1, 100) = <span class=\"ddp-txt-sub-det\">1</span>#BETWEEN(0, 1, 100) = <span class=\"ddp-txt-sub-det\">0</span>#BETWEEN('aab', 'aaa', 'aac') = <span class=\"ddp-txt-sub-det\">1</span>","If the first input value is in range, returns zero if it is not in 1.","search: The value you want to find.#start_value: The value that starts the comparison range.#end_value: The value that ends the comparison range.","BETWEEN(10, 1, 100) = <span class=\"ddp-txt-sub-det\">1</span>#BETWEEN(0, 1, 100) = <span class=\"ddp-txt-sub-det\">0</span>#BETWEEN('aab', 'aaa', 'aac') = <span class=\"ddp-txt-sub-det\">1</span>"
84,PAGE-CALCULATION,LOGICAL,LOGICAL FIELD,LOGICAL FUNCTION,STARTSWITH,1,Y,0,"대상 문자열이 시작 문자열로 시작하는지를 확인하여 같으면 1 다르면 0을 반환합니다.","STARTSWITH(search, prefix)","search: 대상이 되는 문자열입니다.#prefix: 매칭을 확인하고자하는 시작 문자열입니다.","STARTSWITH('abcdef', 'abc') = <span class=\"ddp-txt-sub-det\">1</span>#STARTSWITH('abcdef', 'aabc') = <span class=\"ddp-txt-sub-det\">0</span>#STARTSWITH('1234', '12') = <span class=\"ddp-txt-sub-det\">1</span>","Verify that the destination string starts with the start string, and if it is the same, if different.","search: The string to be targeted.#prefix: Start string to check matches.","STARTSWITH('abcdef', 'abc') = <span class=\"ddp-txt-sub-det\">1</span>#STARTSWITH('abcdef', 'aabc') = <span class=\"ddp-txt-sub-det\">0</span>#STARTSWITH('1234', '12') = <span class=\"ddp-txt-sub-det\">1</span>"
85,PAGE-CALCULATION,LOGICAL,LOGICAL FIELD,LOGICAL FUNCTION,ENDSWITH,1,Y,0,"대상 문자열이 시작 문자열로 끝나는지를 확인하여 같으면 1 다르면 0을 반환합니다.","ENDSWITH(search, suffix)","search: 대상이 되는 문자열입니다.#suffix: 매칭을 확인하고자하는 끝 문자열입니다.","ENDSWITH('abcdef', 'def') = <span class=\"ddp-txt-sub-det\">1</span>#ENDSWITH('abcdef', 'de') = <span class=\"ddp-txt-sub-det\">0</span>#ENDSWITH('1234', '1234') = <span class=\"ddp-txt-sub-det\">1</span>","Verify that the destination string ends with the start string, and if it is the same, if different.","search: The string to be targeted.#suffix: The end string to determine the match.","ENDSWITH('abcdef', 'def') = <span class=\"ddp-txt-sub-det\">1</span>#ENDSWITH('abcdef', 'de') = <span class=\"ddp-txt-sub-det\">0</span>#ENDSWITH('1234', '1234') = <span class=\"ddp-txt-sub-det\">1</span>"
86,PAGE-CALCULATION,LOGICAL,LOGICAL FIELD,LOGICAL FUNCTION,STARTSWITHIGNORECASE,1,Y,0,"대상 문자열이 대소문자를 무시하고 시작 문자열로 시작하는지를 확인하여 같으면 1 다르면 0을 반환합니다.","STARTSWITHIGNORECASE(search,prefix)","search: 대상이 되는 문자열입니다.#prefix: 매칭을 확인하고자하는 시작 문자열입니다.","STARTSWITHIGNORECASE('ABCDEF', 'abc') = <span class=\"ddp-txt-sub-det\">1</span>#STARTSWITHIGNORECASE('abcdef', 'ABC') = <span class=\"ddp-txt-sub-det\">1</span>#STARTSWITHIGNORECASE('1234', 'a12') = <span class=\"ddp-txt-sub-det\">0</span>","Confirm that the target string overrides the case and begins with the start string, if equal, returns 0.","search: The string to be targeted.#prefix: Start string to check matches.","STARTSWITHIGNORECASE('ABCDEF', 'abc') = <span class=\"ddp-txt-sub-det\">1</span>#STARTSWITHIGNORECASE('abcdef', 'ABC') = <span class=\"ddp-txt-sub-det\">1</span>#STARTSWITHIGNORECASE('1234', 'a12') = <span class=\"ddp-txt-sub-det\">0</span>"
87,PAGE-CALCULATION,LOGICAL,LOGICAL FIELD,LOGICAL FUNCTION,ENDSWITHIGNORECASE,1,Y,0,"대상 문자열이 대소문자를 무시하고 시작 문자열로 끝나는지를 확인하여 같으면 1 다르면 0을 반환합니다.","ENDSWITHIGNORECASE(search, suffix)","search: 대상이 되는 문자열입니다.#suffix: 매칭을 확인하고자하는 끝 문자열입니다.","ENDSWITHIGNORECASE('ABCDEF', 'def') = <span class=\"ddp-txt-sub-det\">1</span>#ENDSWITHIGNORECASE('abcdef', 'deF') = <span class=\"ddp-txt-sub-det\">1</span>#ENDSWITHIGNORECASE('1234', '34') = <span class=\"ddp-txt-sub-det\">1</span>","Confirm that the target string overrides the case and ends with the start string, if equal, returns 0.","search: The string to be targeted.#suffix: The end string to determine the match.","ENDSWITHIGNORECASE('ABCDEF', 'def') = <span class=\"ddp-txt-sub-det\">1</span>#ENDSWITHIGNORECASE('abcdef', 'deF') = <span class=\"ddp-txt-sub-det\">1</span>#ENDSWITHIGNORECASE('1234', '34') = <span class=\"ddp-txt-sub-det\">1</span>"
88,PAGE-CALCULATION,STRING,STRING FIELD,STRING FUNCTION,CONTAINS,1,Y,0,"텍스트 문자열에서 지정된 문자열을 찾아 있으면 1 없으면 0을 반환합니다.","CONTAINS(text, find_text)","text: 대상이 되는 텍스트 문자열입니다.#find_text: 찾고자하는 텍스트 문자열입니다.","CONTAINS('abcdefg', 'cde') = <span class=\"ddp-txt-sub-det\">1</span>#CONTAINS('abcdefg', 'bdf') = <span class=\"ddp-txt-sub-det\">0</span>#CONTAINS('123 abc', '3 a') = <span class=\"ddp-txt-sub-det\">1</span>","If a specified string is found in the text string, returns 0 if not 1.","text: The text string to which it is targeted.#find_text: The text string you want to find.","CONTAINS('abcdefg', 'cde') = <span class=\"ddp-txt-sub-det\">1</span>#CONTAINS('abcdefg', 'bdf') = <span class=\"ddp-txt-sub-det\">0</span>#CONTAINS('123 abc', '3 a') = <span class=\"ddp-txt-sub-det\">1</span>"
89,PAGE-CALCULATION,STRING,STRING FIELD,STRING FUNCTION,MATCH,1,Y,0,"regex_text으로 match를 확인하여 matching되면 1 아니면 0을 반환합니다.","MATCH(text , regex_text)","text: 대상이 되는 텍스트 문자열입니다.#regex_text: 찾고자하는 정규 표현식 문자열입니다.","MATCH('Funiture' , 'F.*') = <span class=\"ddp-txt-sub-det\">1</span>#MATCH('Funiture' , 'tu.*') = <span class=\"ddp-txt-sub-det\">1</span>#MATCH('Technology' , 'F.*') = <span class=\"ddp-txt-sub-det\">0</span>","Check match with regex_text and return 1 or 0.","text: The text string to which it is targeted.#regex_text: The regular expression string you want to find.","MATCH('Funiture' , 'F.*') = <span class=\"ddp-txt-sub-det\">1</span>#MATCH('Funiture' , 'tu.*') = <span class=\"ddp-txt-sub-det\">1</span>#MATCH('Technology' , 'F.*') = <span class=\"ddp-txt-sub-det\">0</span>"
90,PAGE-CALCULATION,TIME,TIME FIELD,TIME FUNCTION,NOW,1,Y,0,"현재 시간을 반환합니다.","NOW()","","NOW() = <span class=\"ddp-txt-sub-det\">1496033278862</span>#CAST(NOW(), 'DATETIME') = <span class=\"ddp-txt-sub-det\">'2017-05-29T04:47:58.862Z'</span>#DATEDIFF('2011-01-04 00:00:00', NOW()) = <span class=\"ddp-txt-sub-det\">2337</span>","Returns the current time.","","NOW() = <span class=\"ddp-txt-sub-det\">1496033278862</span>#CAST(NOW(), 'DATETIME') = <span class=\"ddp-txt-sub-det\">'2017-05-29T04:47:58.862Z'</span>#DATEDIFF('2011-01-04 00:00:00', NOW()) = <span class=\"ddp-txt-sub-det\">2337</span>"
91,PAGE-CALCULATION,TIME,TIME FIELD,TIME FUNCTION,CURRENT_TIME,1,Y,0,"현재 시간을 문자열로 반환합니다.","CURRENT_TIME()","","CURRENT_TIME() = <span class=\"ddp-txt-sub-det\">'2018-06-20T00:49:43.753Z'</span>#DATEDIFF('2011-01-04 00:00:00', CURRENT_TIME()) = <span class=\"ddp-txt-sub-det\">2724</span>","Returns the current time as a string.","","CURRENT_TIME() = <span class=\"ddp-txt-sub-det\">'2018-06-20T00:49:43.753Z'</span>#DATEDIFF('2011-01-04 00:00:00', CURRENT_TIME()) = <span class=\"ddp-txt-sub-det\">2724</span>"
