id,categoryCode,commonCode,categoryCommonCodeNm,commonCodeNm,commonValue,commonCodeSNO,commonUseFl,version,description,syntax,param,example,descriptionEn,paramEn,exampleEn
92,PAGE-CALCULATION,TIME,TIME FIELD,TIME FUNCTION,RECENT,1,Y,0,"현재 시간을 기준으로 입력된 범위에 따라 기간을 반환합니다.","RECENT(beforenow)#RECENT(beforenow, afternow)","beforenow: 현재 시간을 기준으로 이전 시간까지의 기간입니다. (Y-year, M-month, W-week, D-day, H-hour, m-minute, s-seconde)#afternow: 현재 시간을 기준으로 이후 시간까지의 기간입니다.","RECENT('12M') = <span class=\"ddp-txt-sub-det\">'2017-06-20T00:38:10.407Z/2018-06-20T00:38:10.407Z'</span>#RECENT('30D','30H') = <span class=\"ddp-txt-sub-det\">'2018-05-21T00:38:10.408Z/2018-06-18T18:38:10.408Z'</span>","Returns the duration based on the range entered based on the current time.","beforenow: The period from the current time to the previous time. (Y-year, M-month, W-week, D-day, H-hour, m-minute, s-seconde)#aflow: The period from the current time to the later time.","RECENT('12M') = <span class=\"ddp-txt-sub-det\">'2017-06-20T00:38:10.407Z/2018-06-20T00:38:10.407Z'</span>#RECENT('30D','30H') = <span class=\"ddp-txt-sub-det\">'2018-05-21T00:38:10.408Z/2018-06-18T18:38:10.408Z'</span>"
93,PAGE-CALCULATION,TIME,TIME FIELD,TIME FUNCTION,BUCKETSTART,1,Y,0,"기준 시간이 속하는 시간 단위 bucket의 시작 시간을 millisecond로 반환합니다.","BUCKETSTART(base_time, granularity_type)","base_time: 기준이 되는 시간입니다.#granularity_type: bucket의 크기를 의미하는 시간의 단위입니다. (SECOND-PT1S, MINUTE-PT1M, FIVE_MINUTE-PT5M, TEN_MINUTE-PT10M, HOUR-PT5H, SIX_HOUR-PT6H,DAY-P1D, WEEK-P1W, MONTH-P1M, QUARTER-P3M, YEAR-P1Y)","BUCKETSTART(DATETIME('2018-02-03T10:12:10'), 'TEN_MINUTE') = <span class=\"ddp-txt-sub-det\"> 1517652600000</span>#BUCKETSTART(DATETIME('2018-02-03T10:12:10'), 'PT10M') = <span class=\"ddp-txt-sub-det\">1517652600000</span>#BUCKETSTART(DATETIME('2018-02-03T10:12:10'), 'YEAR') = <span class=\"ddp-txt-sub-det\">1514764800000</span>","Returns the start time in milliscond for the unit of time bucket to which the reference time belongs.","Base_time: The time by which it is based.#granularity_type: The unit of time that represents the size of the bucket. (SECOND-PT1S, MINUTE-PT1M, FIVE_MINUTE-PT5M, TEN_MINUTE-PT10M, HOUR-PT6H, SIX_HOUR-PT6H,DAY-P1D, WEKE-P1WWWWHERP, Q1P1P, M1TWERM","BUCKETSTART(DATETIME('2018-02-03T10:12:10'), 'TEN_MINUTE') = <span class=\"ddp-txt-sub-det\"> 1517652600000</span>#BUCKETSTART(DATETIME('2018-02-03T10:12:10'), 'PT10M') = <span class=\"ddp-txt-sub-det\">1517652600000</span>#BUCKETSTART(DATETIME('2018-02-03T10:12:10'), 'YEAR') = <span class=\"ddp-txt-sub-det\">1514764800000</span>"
94,PAGE-CALCULATION,TIME,TIME FIELD,TIME FUNCTION,BUCKETEND,1,Y,0,"기준 시간이 속하는 시간 단위 bucket의 끝 시간을 millisecond로 반환합니다.","BUCKETEND(base_time, granularity_type)","base_time: 기준이 되는 시간입니다.#granularity_type: bucket의 크기를 의미하는 시간의 단위입니다. (SECOND-PT1S, MINUTE-PT1M, FIVE_MINUTE-PT5M, TEN_MINUTE-PT10M, HOUR-PT5H, SIX_HOUR-PT6H,DAY-P1D, WEEK-P1W, MONTH-P1M, QUARTER-P3M, YEAR-P1Y)","BUCKETEND(DATETIME('2018-02-03T10:12:10'), 'TEN_MINUTE') = <span class=\"ddp-txt-sub-det\"> 1517653200000</span>#BUCKETEND(DATETIME('2018-02-03T10:12:10'), 'PT10M') = <span class=\"ddp-txt-sub-det\">1517653200000</span>#BUCKETEND(DATETIME('2018-02-03T10:12:10'), 'YEAR') = <span class=\"ddp-txt-sub-det\">1546300800000</span>","Returns the end time of the unit of time bucket to which the reference time belongs in milliscond.","Base_time: The time by which it is based.#granularity_type: The unit of time that represents the size of the bucket. (SECOND-PT1S, MINUTE-PT1M, FIVE_MINUTE-PT5M, TEN_MINUTE-PT10M, HOUR-PT6H, SIX_HOUR-PT6H,DAY-P1D, WEKE-P1WWWWHERP, Q1P1P, M1TWERM","BUCKETEND(DATETIME('2018-02-03T10:12:10'), 'TEN_MINUTE') = <span class=\"ddp-txt-sub-det\"> 1517653200000</span>#BUCKETEND(DATETIME('2018-02-03T10:12:10'), 'PT10M') = <span class=\"ddp-txt-sub-det\">1517653200000</span>#BUCKETEND(DATETIME('2018-02-03T10:12:10'), 'YEAR') = <span class=\"ddp-txt-sub-det\">1546300800000</span>"
95,PAGE-CALCULATION,TIME,TIME FIELD,TIME FUNCTION,BUCKETSTARTDATETIME,1,Y,0,"기준 시간이 속하는 시간 단위 bucket의 시작 시간을 datetime으로 반환합니다.","BUCKETSTARTDATETIME(base_time, granularity_type)","base_time: 기준이 되는 시간입니다.#granularity_type: bucket의 크기를 의미하는 시간의 단위입니다. (SECOND-PT1S, MINUTE-PT1M, FIVE_MINUTE-PT5M, TEN_MINUTE-PT10M, HOUR-PT5H, SIX_HOUR-PT6H,DAY-P1D, WEEK-P1W, MONTH-P1M, QUARTER-P3M, YEAR-P1Y)","BUCKETSTARTDATETIME(DATETIME('2018-02-03T10:12:10'), 'TEN_MINUTE') = <span class=\"ddp-txt-sub-det\"> '2018-02-03T10:10:00.000Z'</span>#BUCKETSTARTDATETIME(DATETIME('2018-02-03T10:12:10'), 'PT10M') = <span class=\"ddp-txt-sub-det\">'2018-02-03T10:10:00.000Z'</span>#BUCKETSTARTDATETIME(DATETIME('2018-02-03T10:12:10'), 'YEAR') = <span class=\"ddp-txt-sub-det\">'2018-01-01T00:00:00.000Z'</span>","Returns the start time in datetime for the unit of time buckets to which the reference time belongs.","Base_time: The time by which it is based.#granularity_type: The unit of time that represents the size of the bucket. (SECOND-PT1S, MINUTE-PT1M, FIVE_MINUTE-PT5M, TEN_MINUTE-PT10M, HOUR-PT6H, SIX_HOUR-PT6H,DAY-P1D, WEKE-P1WWWWHERP, Q1P1P, M1TWERM","BUCKETSTARTDATETIME(DATETIME('2018-02-03T10:12:10'), 'TEN_MINUTE') = <span class=\"ddp-txt-sub-det\"> '2018-02-03T10:10:00.000Z'</span>#BUCKETSTARTDATETIME(DATETIME('2018-02-03T10:12:10'), 'PT10M') = <span class=\"ddp-txt-sub-det\">'2018-02-03T10:10:00.000Z'</span>#BUCKETSTARTDATETIME(DATETIME('2018-02-03T10:12:10'), 'YEAR') = <span class=\"ddp-txt-sub-det\">'2018-01-01T00:00:00.000Z'</span>"
96,PAGE-CALCULATION,TIME,TIME FIELD,TIME FUNCTION,BUCKETENDDATETIME,1,Y,0,"기준 시간이 속하는 시간 단위 bucket의 끝 시간을 datetime으로 반환합니다.","BUCKETENDDATETIME(base_time, granularity_type)","base_time: 기준이 되는 시간입니다.#granularity_type: bucket의 크기를 의미하는 시간의 단위입니다. (SECOND-PT1S, MINUTE-PT1M, FIVE_MINUTE-PT5M, TEN_MINUTE-PT10M, HOUR-PT5H, SIX_HOUR-PT6H,DAY-P1D, WEEK-P1W, MONTH-P1M, QUARTER-P3M, YEAR-P1Y)","BUCKETENDDATETIME(DATETIME('2018-02-03T10:12:10'), 'TEN_MINUTE') = <span class=\"ddp-txt-sub-det\">'2018-02-03T10:20:00.000Z'</span>#BUCKETENDDATETIME(DATETIME('2018-02-03T10:12:10'), 'PT10M') = <span class=\"ddp-txt-sub-det\">'2018-02-03T10:20:00.000Z'</span>#BUCKETENDDATETIME(DATETIME('2018-02-03T10:12:10'), YEAR') = <span class=\"ddp-txt-sub-det\">'2019-01-01T00:00:00.000Z'</span>","Returns the end time in datetime of the unit of time bucket to which the reference time belongs.","Base_time: The time by which it is based.#granularity_type: The unit of time that represents the size of the bucket. (SECOND-PT1S, MINUTE-PT1M, FIVE_MINUTE-PT5M, TEN_MINUTE-PT10M, HOUR-PT6H, SIX_HOUR-PT6H,DAY-P1D, WEKE-P1WWWWHERP, Q1P1P, M1TWERM","BUCKETENDDATETIME(DATETIME('2018-02-03T10:12:10'), 'TEN_MINUTE') = <span class=\"ddp-txt-sub-det\">'2018-02-03T10:20:00.000Z'</span>#BUCKETENDDATETIME(DATETIME('2018-02-03T10:12:10'), 'PT10M') = <span class=\"ddp-txt-sub-det\">'2018-02-03T10:20:00.000Z'</span>#BUCKETENDDATETIME(DATETIME('2018-02-03T10:12:10'), YEAR') = <span class=\"ddp-txt-sub-det\">'2019-01-01T00:00:00.000Z'</span>"
97,PAGE-CALCULATION,TIME,TIME FIELD,TIME FUNCTION,ADD_TIME,1,Y,0,"기준 시간에서 기간을 더하여 반환합니다.","ADD_TIME(base_time, period)","base_time: 기준이 되는 시간입니다.#period: 추가하고자하는 기간입니다. (Y-year, M-month, W-week, D-day, H-hour, m-minute, s-seconde)","ADD_TIME('2011-01-04 00:00:00', '1M') = <span class=\"ddp-txt-sub-det\">'2011-02-04T00:00:00.000Z'</span>#ADD_TIME('2011-01-04 00:00:00', '1Y') = <span class=\"ddp-txt-sub-det\">'2012-01-04T00:00:00.000Z'</span>","Returns the duration in addition to the reference time.","Base_time: The time by which it is based.#period: Time to add (Y-year, M-month, W-week, D-day, H-hour, m-minute, s-seconde)","ADD_TIME('2011-01-04 00:00:00', '1M') = <span class=\"ddp-txt-sub-det\">'2011-02-04T00:00:00.000Z'</span>#ADD_TIME('2011-01-04 00:00:00', '1Y') = <span class=\"ddp-txt-sub-det\">'2012-01-04T00:00:00.000Z'</span>"
98,PAGE-CALCULATION,TIME,TIME FIELD,TIME FUNCTION,SUB_TIME,1,Y,0,"기준 시간에서 기간을 빼고 반환합니다.","SUB_TIME(base_time, period)","base_time: 기준이 되는 시간입니다.#period: 빼고자하는 기간입니다. (Y-year, M-month, W-week, D-day, H-hour, m-minute, s-seconde)","SUB_TIME('2011-01-04 00:00:00', '1M') = <span class=\"ddp-txt-sub-det\">'2010-12-04T00:00:00.000Z'</span>#SUB_TIME('2011-01-04 00:00:00', '1Y') = <span class=\"ddp-txt-sub-det\">'2010-01-04T00:00:00.000Z'</span>","Duration is subtracted from the reference time and returns it.","Base_time: The time by which it is based.#period: Time to exclude (Y-year, M-month, W-week, D-day, H-hour, m-minute, s-seconde)","SUB_TIME('2011-01-04 00:00:00', '1M') = <span class=\"ddp-txt-sub-det\">'2010-12-04T00:00:00.000Z'</span>#SUB_TIME('2011-01-04 00:00:00', '1Y') = <span class=\"ddp-txt-sub-det\"> '2010-01-04T00:00:00.000Z'</span>"
99,PAGE-CALCULATION,TIME,TIME FIELD,TIME FUNCTION,DIFFTIME,1,Y,0,"두 시간의 차이를 지정된 시간 단위로 반환합니다.","DIFFTIME(time_unit, start_time, end_time)","time_unit: 결과의 시간 단위입니다. (MILLIS, EPOCH, SECOND, MINUTE, HOUR, DAY, WEEK, MONTH, YEAR)#start_time: 시작 시간입니다.#end_time: 끝 시간입니다.","DIFFTIME('HOUR', '2011-01-04 00:00:00', '2011-01-04 10:00:00') = <span class=\"ddp-txt-sub-det\">10</span>#DIFFTIME('MINUTE', '2011-01-04 00:00:00', '2011-01-04 10:00:00') = <span class=\"ddp-txt-sub-det\">600</span>","Returns the difference between two hours in specified time units.","time_unit: The unit of time in the result. (MILLIS, EPOCH, SECOND, MINUTE, HOUR, DAY, WEEK, MONTH, YEAR)#start_time: Start time.#end_time: End time.","DIFFTIME('HOUR', '2011-01-04 00:00:00', '2011-01-04 10:00:00') = <span class=\"ddp-txt-sub-det\">10</span>#DIFFTIME('MINUTE', '2011-01-04 00:00:00', '2011-01-04 10:00:00') = <span class=\"ddp-txt-sub-det\">600</span>"
100,PAGE-CALCULATION,TIME,TIME FIELD,TIME FUNCTION,DAYNAME,1,Y,0,"입력된 시간을 시간대와 언어에 따라 요일을 반환합니다.","DAYNAME(datetime)#DAYNAME(datetime, timezone)#DAYNAME(datetime, timezone, locale)","datetime: 대상이 되는 시간입니다.#timezone: 시간대입니다.#locale: 출력 언어입니다.","DAYNAME('2011-01-04 00:00:00', 'Asia/Seoul', 'ko') = <span class=\"ddp-txt-sub-det\">'화요일'</span>#DAYNAME('2011-01-04 00:00:00', 'America/Los_Angeles', 'en') = <span class=\"ddp-txt-sub-det\">'Tuesday'</span>#DAYNAME('2011-01-04 00:00:00', 'Asia/Beijing', 'zh') = <span class=\"ddp-txt-sub-det\">'星期二'</span>","Returns the day of the week based on the time zone and language entered.","datetime: The time to be targeted.#timezone: Time zone.#locale: The output language.","DAYNAME('2011-01-04 00:00:00', 'Asia/Seoul', 'ko') = <span class=\"ddp-txt-sub-det\">'화요일'</span>#DAYNAME('2011-01-04 00:00:00', 'America/Los_Angeles', 'en') = <span class=\"ddp-txt-sub-det\">'Tuesday'</span>#DAYNAME('2011-01-04 00:00:00', 'Asia/Beijing', 'zh') = <span class=\"ddp-txt-sub-det\">'星期二'</span>"
101,PAGE-CALCULATION,TIME,TIME FIELD,TIME FUNCTION,DAYOFMONTH,1,Y,0,"달을 기준으로 몇번째 일인지를 반환한다.","DAYOFMONTH(datetime)#DAYOFMONTH(datetime, timezone)","datetime: 대상이 되는 시간입니다.#timezone: 시간대입니다.","DAYOFMONTH('2011-01-04 00:00:00') = <span class=\"ddp-txt-sub-det\">4</span>#DAYOFMONTH('2011-01-30 00:00:00') = <span class=\"ddp-txt-sub-det\">30</span>","Returns the number of days by month","datetime: The time to be targeted.#timezone: Time zone.","DAYOFMONTH('2011-01-04 00:00:00') = <span class=\"ddp-txt-sub-det\">4</span>#DAYOFMONTH('2011-01-30 00:00:00') = <span class=\"ddp-txt-sub-det\">30</span>"
102,PAGE-CALCULATION,TIME,TIME FIELD,TIME FUNCTION,LASTDAYOFMONTH,1,Y,0,"달을 기준으로 마지막 일자를 반환한다.","LASTDAYOFMONTH(datetime)#LASTDAYOFMONTH(datetime, timezone)","datetime: 대상이 되는 시간입니다.#timezone: 시간대입니다.","LASTDAYOFMONTH('2011-01-04 00:00:00') = <span class=\"ddp-txt-sub-det\">31</span>#LASTDAYOFMONTH('2011-02-10 00:00:00') = <span class=\"ddp-txt-sub-det\">28</span>","Returns the last date based on the month","datetime: The time to be targeted.#timezone: Time zone.","LASTDAYOFMONTH('2011-01-04 00:00:00') = <span class=\"ddp-txt-sub-det\">31</span>#LASTDAYOFMONTH('2011-02-10 00:00:00') = <span class=\"ddp-txt-sub-det\">28</span>"
103,PAGE-CALCULATION,TIME,TIME FIELD,TIME FUNCTION,DAYOFWEEK,1,Y,0,"주를 기준으로 몇번째 일인지를 반환한다.","DAYOFWEEK(datetime)#DAYOFWEEK(datetime, timezone)","datetime: 대상이 되는 시간입니다.#timezone: 시간대입니다.","DAYOFWEEK('2011-01-10 00:00:00') = <span class=\"ddp-txt-sub-det\">1(월요일)</span>#DAYOFWEEK('2011-01-30 00:00:00') = <span class=\"ddp-txt-sub-det\">7(일요일)</span>","Returns the number of days by state","datetime: The time to be targeted.#timezone: Time zone.","DAYOFWEEK('2011-01-10 00:00:00') = <span class=\"ddp-txt-sub-det\">1(Monday)</span>#DAYOFWEEK('2011-01-30 00:00:00') = <span class=\"ddp-txt-sub-det\">7(Sunday)</span>"
104,PAGE-CALCULATION,TIME,TIME FIELD,TIME FUNCTION,DAYOFYEAR,1,Y,0,"년을 기준으로 몇번째 일인지를 반환한다.","DAYOFYEAR(datetime)#DAYOFYEAR(datetime, timezone)","datetime: 대상이 되는 시간입니다.#timezone: 시간대입니다.","DAYOFYEAR('2011-02-10 00:00:00') = <span class=\"ddp-txt-sub-det\">41</span>#DAYOFYEAR('2011-12-31 00:00:00') = <span class=\"ddp-txt-sub-det\">365</span>","Returns the number of days by year","datetime: The time to be targeted.#timezone: Time zone.","DAYOFYEAR('2011-02-10 00:00:00') = <span class=\"ddp-txt-sub-det\">41</span>#DAYOFYEAR('2011-12-31 00:00:00') = <span class=\"ddp-txt-sub-det\">365</span>"
105,PAGE-CALCULATION,TIME,TIME FIELD,TIME FUNCTION,WEEKOFWEEKYEAR,1,Y,0,"주 번호가 속하는 연도에서 몇번째 주인지를 반환합니다.","WEEKOFWEEKYEAR(datetime)#WEEKOFWEEKYEAR(datetime, timezone)","datetime: 대상이 되는 시간입니다.#timezone: 시간대입니다.</ul>","WEEKOFWEEKYEAR('2011-01-01 00:00:00') = <span class=\"ddp-txt-sub-det\">52</span>#WEEKOFWEEKYEAR('2011-01-07 00:00:00') = <span class=\"ddp-txt-sub-det\">1</span>","Returns the number of addresses in the year in which the main number belongs.","datetime: The time to be targeted.#timezone: Time zone.</ul>","WEEKOFWEEKYEAR('2011-01-01 00:00:00') = <span class=\"ddp-txt-sub-det\">52</span>#WEEKOFWEEKYEAR('2011-01-07 00:00:00') = <span class=\"ddp-txt-sub-det\">1</span>"
106,PAGE-CALCULATION,TIME,TIME FIELD,TIME FUNCTION,WEEKYEAR,1,Y,0,"주 번호가 속하는 연도를 반환합니다.","WEEKYEAR(datetime)#WEEKYEAR(datetime, timezone)","datetime: 대상이 되는 시간입니다.#timezone: 시간대입니다.","WEEKYEAR('2011-01-01 00:00:00') = <span class=\"ddp-txt-sub-det\">2010</span>#WEEKYEAR('2011-12-31 00:00:00') = <span class=\"ddp-txt-sub-det\">2011</span>","Returns the year in which the main number belongs.","datetime: The time to be targeted.#timezone: Time zone.","WEEKYEAR('2011-01-01 00:00:00') = <span class=\"ddp-txt-sub-det\">2010</span>#WEEKYEAR('2011-12-31 00:00:00') = <span class=\"ddp-txt-sub-det\">2011</span>"
107,PAGE-CALCULATION,TIME,TIME FIELD,TIME FUNCTION,HOUR,1,Y,0,"대상 시간에서 시를 반환합니다.","HOUR(datetime)#HOUR(datetime, timezone)","datetime: 대상이 되는 시간입니다.#timezone: 시간대입니다.","HOUR('2011-01-04 10:00:00') = <span class=\"ddp-txt-sub-det\">10</span>#HOUR('2011-01-04 20:20:00') = <span class=\"ddp-txt-sub-det\">20</span>#HOUR('2011-01-04 23:00:00') = <span class=\"ddp-txt-sub-det\">23</span>","Returns a poem from the target time.","datetime: The time to be targeted.#timezone: Time zone.","HOUR('2011-01-04 10:00:00') = <span class=\"ddp-txt-sub-det\">10</span>#HOUR('2011-01-04 20:20:00') = <span class=\"ddp-txt-sub-det\">20</span>#HOUR('2011-01-04 23:00:00') = <span class=\"ddp-txt-sub-det\">23</span>"
108,PAGE-CALCULATION,TIME,TIME FIELD,TIME FUNCTION,MONTH,1,Y,0,"대상 시간에서 월을 반환합니다.","MONTH(datetime)#MONTH(datetime, timezone)","datetime: 대상이 되는 시간입니다.#timezone: 시간대입니다.","MONTH('2011-01-04 10:00:00') = <span class=\"ddp-txt-sub-det\">1</span>#MONTH('2011-05-04 20:20:00') = <span class=\"ddp-txt-sub-det\">5</span>#MONTH('2012-10-04 23:00:00') = <span class=\"ddp-txt-sub-det\">10</span>","Returns the month from the target time.","datetime: The time to be targeted.#timezone: Time zone.","MONTH('2011-01-04 10:00:00') = <span class=\"ddp-txt-sub-det\">1</span>#MONTH('2011-05-04 20:20:00') = <span class=\"ddp-txt-sub-det\">5</span>#MONTH('2012-10-04 23:00:00') = <span class=\"ddp-txt-sub-det\">10</span>"
109,PAGE-CALCULATION,TIME,TIME FIELD,TIME FUNCTION,MONTHNAME,1,Y,0,"입력된 시간을 시간대와 언어에 따라 월을 반환합니다.","MONTHNAME(datetime)#MONTHNAME(datetime, timezone)#MONTHNAME(datetime, timezone, locale)","datetime: 대상이 되는 시간입니다.#timezone: 시간대입니다.#locale: 출력 언어입니다.","MONTHNAME('2011-01-04 10:00:00', 'Asia/Seoul', 'ko') = <span class=\"ddp-txt-sub-det\">'1월'</span>#MONTHNAME('2011-05-04 20:20:00', 'America/Los_Angeles', 'en') = <span class=\"ddp-txt-sub-det\">'May'</span>#MONTHNAME('2012-10-04 23:00:00', 'Asia/Beijing', 'zh') = <span class=\"ddp-txt-sub-det\">'十月'</span>","Returns the month based on the time zone and language entered.","datetime: The time to be targeted.#timezone: Time zone.#locale: The output language.","MONTHNAME('2011-01-04 10:00:00', 'Asia/Seoul', 'ko') = <span class=\"ddp-txt-sub-det\">'1월'</span>#MONTHNAME('2011-05-04 20:20:00', 'America/Los_Angeles', 'en') = <span class=\"ddp-txt-sub-det\">'May'</span>#MONTHNAME('2012-10-04 23:00:00', 'Asia/Beijing', 'zh') = <span class=\"ddp-txt-sub-det\">'十月'</span>"
110,PAGE-CALCULATION,TIME,TIME FIELD,TIME FUNCTION,YEAR,1,Y,0,"대상 시간에서 년을 반환합니다.","YEAR(datetime)#YEAR(datetime, timezone)","datetime: 대상이 되는 시간입니다.#timezone: 시간대입니다.","YEAR('2011-01-04 10:00:00') = <span class=\"ddp-txt-sub-det\">2011</span>#YEAR('2013-05-04 20:20:00') = <span class=\"ddp-txt-sub-det\">2013</span>#YEAR('2015-10-04 23:00:00') = <span class=\"ddp-txt-sub-det\">2015</span>","Returns the year from the target time.","datetime: The time to be targeted.#timezone: Time zone.","YEAR('2011-01-04 10:00:00') = <span class=\"ddp-txt-sub-det\">2011</span>#YEAR('2013-05-04 20:20:00') = <span class=\"ddp-txt-sub-det\">2013</span>#YEAR('2015-10-04 23:00:00') = <span class=\"ddp-txt-sub-det\">2015</span>"
111,PAGE-CALCULATION,TIME,TIME FIELD,TIME FUNCTION,FIRST_DAY,1,Y,0,"대상 시간에서 월의 첫번째 일자를 반환합니다.","FIRST_DAY(datetime)#FIRST_DAY(datetime, timezone)","datetime: 대상이 되는 시간입니다.#timezone: 시간대입니다.","FIRST_DAY('2011-01-04 10:00:00') = <span class=\"ddp-txt-sub-det\">'2011-01-01T10:00:00.000Z'</span>#FIRST_DAY('2013-05-04 20:20:00') = <span class=\"ddp-txt-sub-det\">'2013-05-01T20:20:00.000Z'</span>#FIRST_DAY('2015-10-04 23:00:00') = <span class=\"ddp-txt-sub-det\">'2015-10-01T23:00:00.000Z'</span>","Returns the first date of the month in the destination time.","datetime: The time to be targeted.#timezone: Time zone.","FIRST_DAY('2011-01-04 10:00:00') = <span class=\"ddp-txt-sub-det\">'2011-01-01T10:00:00.000Z'</span>#FIRST_DAY('2013-05-04 20:20:00') = <span class=\"ddp-txt-sub-det\">'2013-05-01T20:20:00.000Z'</span>#FIRST_DAY('2015-10-04 23:00:00') = <span class=\"ddp-txt-sub-det\">'2015-10-01T23:00:00.000Z'</span>"
112,PAGE-CALCULATION,TIME,TIME FIELD,TIME FUNCTION,LAST_DAY,1,Y,0,"대상 시간에서 월의 마지막 일자를 반환합니다.","LAST_DAY(datetime)#LAST_DAY(datetime, timezone)","datetime: 대상이 되는 시간입니다.#timezone: 시간대입니다.","LAST_DAY('2011-01-04 10:00:00') = <span class=\"ddp-txt-sub-det\">'2011-01-31T10:00:00.000Z'</span>#LAST_DAY('2013-05-04 20:20:00') = <span class=\"ddp-txt-sub-det\">'2013-05-31T20:20:00.000Z'</span>#LAST_DAY('2015-02-04 23:00:00') = <span class=\"ddp-txt-sub-det\">'2015-02-28T23:00:00.000Z'</span>","Returns the last date of the month in the destination time.","datetime: The time to be targeted.#timezone: Time zone.","LAST_DAY('2011-01-04 10:00:00') = <span class=\"ddp-txt-sub-det\">'2011-01-31T10:00:00.000Z'</span>#LAST_DAY('2013-05-04 20:20:00') = <span class=\"ddp-txt-sub-det\">'2013-05-31T20:20:00.000Z'</span>#LAST_DAY('2015-02-04 23:00:00') = <span class=\"ddp-txt-sub-det\">'2015-02-28T23:00:00.000Z'</span>"
113,PAGE-CALCULATION,TIME,TIME FIELD,TIME FUNCTION,DATETIME,1,Y,0,"날짜-시간 문자열을 시간으로 변환하여 반환합니다.","DATETIME(datetime_string)#DATETIME(datetime_string, format)#DATETIME(datetime_string, format, timezone)","datetime_string: 변환할 대상이 되는 날짜-시간을 표시하는 문자열입니다.#format: 입력된 문자열을 변환할 구조를 의미합니다. 입력이 없을 경우 'yyyy-MM-dd'T'HH:mm:ss[.SSS][ZZ]'가 적용됩니다.#timezone: 시간대입니다.","DATETIME('2011-01-04T10:00:00') = <span class=\"ddp-txt-sub-det\">'2011-01-04T10:00:00.000Z'</span>#DATETIME('2011-01-04 10:00:00', 'yyyy-MM-dd HH:mm:ss') = <span class=\"ddp-txt-sub-det\">'2011-01-04T10:00:00.000Z'</span>#DATETIME('2011-01-04 10:00:00', 'yyyy-MM-dd HH:mm:ss', 'Asia/Seoul') = <span class=\"ddp-txt-sub-det\">'2011-01-04T10:00:00.000+09:00'</span>","Returns a date-time string by converting it to time.","datetime_string: A string that represents the date-time to be converted.#format: means the structure to convert the entered string. If no input is available, 'yyyy-MM-dd'T'HH:mm:ss[.SSS' applies.#timezone: Time zone.","DATETIME('2011-01-04T10:00:00') = <span class=\"ddp-txt-sub-det\">'2011-01-04T10:00:00.000Z'</span>#DATETIME('2011-01-04 10:00:00', 'yyyy-MM-dd HH:mm:ss') = <span class=\"ddp-txt-sub-det\">'2011-01-04T10:00:00.000Z'</span>#DATETIME('2011-01-04 10:00:00', 'yyyy-MM-dd HH:mm:ss', 'Asia/Seoul') = <span class=\"ddp-txt-sub-det\">'2011-01-04T10:00:00.000+09:00'</span>"
114,PAGE-CALCULATION,TIME,TIME FIELD,TIME FUNCTION,DATETIME_MILLIS,1,Y,0,"날짜-시간 문자열을 millisecond로 변환하여 반환합니다.","DATETIME_MILLIS(datetime_string)#DATETIME_MILLIS(datetime_string, format)#DATETIME_MILLIS(datetime_string, format, timezone)","datetime_string: 변환할 대상이 되는 날짜-시간을 표시하는 문자열입니다.#format: 입력된 문자열을 변환할 구조를 의미합니다. 입력이 없을 경우 'yyyy-MM-dd'T'HH:mm:ss[.SSS][ZZ]'가 적용됩니다.#timezone: 시간대입니다.","DATETIME_MILLIS('2011-01-04T10:00:00') = <span class=\"ddp-txt-sub-det\">1294135200000</span>#DATETIME_MILLIS('2011-01-04 10:00:00', 'yyyy-MM-dd HH:mm:ss') = <span class=\"ddp-txt-sub-det\">1294135200000</span>#DATETIME_MILLIS('2011-01-04 10:00:00', 'yyyy-MM-dd HH:mm:ss', 'Asia/Seoul') = <span class=\"ddp-txt-sub-det\">1294102800000</span>","Converts the date-time string to milliscond and returns it.","datetime_string: A string that represents the date-time to be converted.#format: means the structure to convert the entered string. If no input is available, 'yyyy-MM-dd'T'HH:mm:ss[.SSS' applies.#timezone: Time zone.","DATETIME_MILLIS('2011-01-04T10:00:00') = <span class=\"ddp-txt-sub-det\">1294135200000</span>#DATETIME_MILLIS('2011-01-04 10:00:00', 'yyyy-MM-dd HH:mm:ss') = <span class=\"ddp-txt-sub-det\">1294135200000</span>#DATETIME_MILLIS('2011-01-04 10:00:00', 'yyyy-MM-dd HH:mm:ss', 'Asia/Seoul') = <span class=\"ddp-txt-sub-det\">1294102800000</span>"
115,PAGE-CALCULATION,TIME,TIME FIELD,TIME FUNCTION,TIMESTAMP_VALIDATE,1,Y,0,"문자열 시간을 변환 가능 여부를 boolean으로 반환합니다.","TIMESTAMP_VALIDATE(datetime_string)#TIMESTAMP_VALIDATE(datetime_string,format)#TIMESTAMP_VALIDATE(datetime_string,format,timezone)#TIMESTAMP_VALIDATE(datetime_string,format,timezone, locale)","datetime_string: 변환할 대상이 되는 날짜-시간을 표시하는 문자열입니다.#format: 입력된 문자열을 변환할 구조를 의미합니다. 입력이 없을 경우 'yyyy-MM-dd'T'HH:mm:ss[.SSS][ZZ]'가 적용됩니다.#timezone: 시간대입니다.#locale: 출력 언어입니다.","TIMESTAMP_VALIDATE('2011-01-04T10:00:00') = <span class=\"ddp-txt-sub-det\">1</span>#TIMESTAMP_VALIDATE('2011-01-04 10:00:00', 'yyyy-MM-dd HH:mm') = <span class=\"ddp-txt-sub-det\">0</span>#TIMESTAMP_VALIDATE('2011-01-04 10:00:00', 'yyyy-MM-dd HH:mm:ss', 'Asia/Seoul') = <span class=\"ddp-txt-sub-det\">1</span>","Returns whether the string time is convertable to boolean.","datetime_string: A string that represents the date-time to be converted.#format: means the structure to convert the entered string. If no input is available, 'yyyy-MM-dd'T'HH:mm:ss[.SSS' applies.#timezone: Time zone.#locale: The output language.","TIMESTAMP_VALIDATE('2011-01-04T10:00:00') = <span class=\"ddp-txt-sub-det\">1</span>#TIMESTAMP_VALIDATE('2011-01-04 10:00:00', 'yyyy-MM-dd HH:mm') = <span class=\"ddp-txt-sub-det\">0</span>#TIMESTAMP_VALIDATE('2011-01-04 10:00:00', 'yyyy-MM-dd HH:mm:ss', 'Asia/Seoul') = <span class=\"ddp-txt-sub-det\">1</span>"
