id,categoryCode,commonCode,categoryCommonCodeNm,commonCodeNm,commonValue,commonCodeSNO,commonUseFl,version,description,syntax,param,example,descriptionEn,paramEn,exampleEn
39,PAGE-CALCULATION,MATH,MATH FIELD,MATH FUNCTION,COPYSIGN,1,Y,0,"두 번째 부동 소수점 인수의 부호와 최초의 부동 소수점 인수를 반환합니다.","COPYSIGN(magnitude, sign)","magnitude: 결과의 크기를 제공하는 파라미터입니다.#sign: 매개 변수는 결과의 부호를 제공합니다.","COPYSIGN(90, 0) = <span class=\"ddp-txt-sub-det\">90.0</span>#COPYSIGN(125.9f, -0.4873f) = <span class=\"ddp-txt-sub-det\">-125.9</span>#COPYSIGN(-0.4873f, 125.9f) = <span class=\"ddp-txt-sub-det\">0.4873</span>#COPYSIGN(90, -90) = <span class=\"ddp-txt-sub-det\">-90.0</span>","Returns the sign of the second floating point argument and the first floating point argument.","magnitude: Parameter that provides the size of the result.#sign: The parameter provides the sign of the result.","COPYSIGN(90, 0) = <span class=\"ddp-txt-sub-det\">90.0</span>#COPYSIGN(125.9f, -0.4873f) = <span class=\"ddp-txt-sub-det\">-125.9</span>#COPYSIGN(-0.4873f, 125.9f) = <span class=\"ddp-txt-sub-det\">0.4873</span>#COPYSIGN(90, -90) = <span class=\"ddp-txt-sub-det\">-90.0</span>"
40,PAGE-CALCULATION,MATH,MATH FIELD,MATH FUNCTION,HYPOT,1,Y,0,"직각삼각형의 빗변의 길이를 반환합니다.","HIPOT(x_num, y_num)","x_num: 임의의 실수를 나타냅니다.#y_num: 임의의 실수를 나타냅니다.","HYPOT(90, 0) = <span class=\"ddp-txt-sub-det\">90.0</span>#HYPOT(90, 90) = <span class=\"ddp-txt-sub-det\">127.27922061357856</span>#HYPOT(10, 30) = <span class=\"ddp-txt-sub-det\">31.622776601683793</span>#HYPOT(90, -90) = <span class=\"ddp-txt-sub-det\">-127.27922061357856</span>","Returns the length of the side of the right triangle.","x_num: Indicates any error.#y_num: Indicates any error.","HYPOT(90, 0) = <span class=\"ddp-txt-sub-det\">90.0</span>#HYPOT(90, 90) = <span class=\"ddp-txt-sub-det\">127.27922061357856</span>#HYPOT(10, 30) = <span class=\"ddp-txt-sub-det\">31.622776601683793</span>#HYPOT(90,-90) = <span class=\"ddp-txt-sub-det\">-127.27922061357856</span>"
41,PAGE-CALCULATION,MATH,MATH FIELD,MATH FUNCTION,REMAINDER,1,Y,0,"나눗셈의 나머지를 구합니다.","REMAINDER(number, divisor)","number: 나머지를 구하려는 수입니다.#divisor: 나누는 수입니다.","REMAINDER(90, 5) = <span class=\"ddp-txt-sub-det\">0</span>#REMAINDER(91, 90) = <span class=\"ddp-txt-sub-det\">1</span>#REMAINDER(10, 30) = <span class=\"ddp-txt-sub-det\">10</span>#REMAINDER(90, -90) = <span class=\"ddp-txt-sub-det\">0</span>","Find the rest of the division.","number: The number of times you want to get the rest.#divisor: Number of divisions.","REMAINDER(90, 5) = <span class=\"ddp-txt-sub-det\">0</span>#REMAINDER(91, 90) = <span class=\"ddp-txt-sub-det\">1</span>#REMAINDER(10, 30) = <span class=\"ddp-txt-sub-det\">10</span>#REMAINDER(90, -90) = <span class=\"ddp-txt-sub-det\">0</span>"
42,PAGE-CALCULATION,MATH,MATH FIELD,MATH FUNCTION,MAX,1,Y,0,"최대값을 구합니다.","MAX(number1, number2)","number1: 최대값을 구하려는 수입니다.#number2: 최대값을 구하려는 수입니다.","MAX(90, 5) = <span class=\"ddp-txt-sub-det\">90</span>#MAX(5, 90) = <span class=\"ddp-txt-sub-det\">90</span>#MAX(123, 123) = <span class=\"ddp-txt-sub-det\">123</span>#MAX(90, -90) = <span class=\"ddp-txt-sub-det\">90</span>","Obtain the maximum value.","number1: The number of times you want to obtain the maximum value.#number2: The number of times you want to get the maximum value.","MAX(90, 5) = <span class=\"ddp-txt-sub-det\">90</span>#MAX(5, 90) = <span class=\"ddp-txt-sub-det\">90</span>#MAX(123, 123) = <span class=\"ddp-txt-sub-det\">123</span>#MAX(90, -90) = <span class=\"ddp-txt-sub-det\">90</span>"
43,PAGE-CALCULATION,MATH,MATH FIELD,MATH FUNCTION,MIN,1,Y,0,"최소값을 구합니다.","MIN(number1, number2)","number1: 최소값을 구하려는 수입니다.#number2: 최소값을 구하려는 수입니다.","MIN(90, 5) = <span class=\"ddp-txt-sub-det\">5</span>#MIN(5, 90) = <span class=\"ddp-txt-sub-det\">5</span>#MIN(123, 123) = <span class=\"ddp-txt-sub-det\">123</span>#MIN(90, -90) = <span class=\"ddp-txt-sub-det\">-90</span>","Obtain the minimum value.","number1: The number of times you want to obtain the minimum value.#number2: The number of times you want to get the minimum value.","MIN(90, 5) = <span class=\"ddp-txt-sub-det\">5</span>#MIN(5, 90) = <span class=\"ddp-txt-sub-det\">5</span>#MIN(123, 123) = <span class=\"ddp-txt-sub-det\">123</span>#MIN(90,- 90) = <span class=\"ddp-txt-sub-det\">-90</span>"
44,PAGE-CALCULATION,MATH,MATH FIELD,MATH FUNCTION,NEXTAFTER,1,Y,0,"x>y 일 때는 실수로 표현할 수 있는 수 중에 현재 x보다 바로 작은 실수, x<y 일 때는 실수로 표현할 수 있는 수 중에 현재 x보다 바로 큰 실수, x=y 일 때는 x를 반환합니다.","NEXTAFTER(x_num, y_num)","x_num: 임의의 실수를 나타냅니다.#y_num: 임의의 실수를 나타냅니다.","NEXTAFTER(90, 5) = <span class=\"ddp-txt-sub-det\">89.99999999999999</span>#NEXTAFTER(5, 90) = <span class=\"ddp-txt-sub-det\">5.000000000000001</span>#NEXTAFTER(123, 123) = <span class=\"ddp-txt-sub-det\">123</span>#NEXTAFTER(90, -90) = <span class=\"ddp-txt-sub-det\">89.99999999999999</span>","x>y returns the error that can be expressed accidentally, x<y less than the current x, or x=y less than the current x.","x_num: Indicates any error.#y_num: Indicates any error.","NEXTAFTER(90, 5) = <span class=\"ddp-txt-sub-det\">89.99999999999999</span>#NEXTAFTER(5, 90) = <span class=\"ddp-txt-sub-det\">5.000000000000001</span>#NEXTAFTER(123, 123) = <span class=\"ddp-txt-sub-det\">123</span>#NEXTAFTER(90, -90) = <span class=\"ddp-txt-sub-det\">89.99999999999999</span>"
45,PAGE-CALCULATION,MATH,MATH FIELD,MATH FUNCTION,POW,1,Y,0,"밑수를 지정한 만큼 거듭제곱한 결과를 구합니다.","POW(number, power)","number: 밑수입니다.#power: 지수입니다.","POW(2, 4) = <span class=\"ddp-txt-sub-det\">16</span>#POW(4, 2) = <span class=\"ddp-txt-sub-det\">16</span>#POW(1.23, 3) = <span class=\"ddp-txt-sub-det\">1.8608669999999998</span>#POW(90, -2) = <span class=\"ddp-txt-sub-det\">1.234567901234568E-4</span>","Obtains the result of repeated subdivisions as specified.","Number: Base.#power: Index.","POW(2, 4) = <span class=\"ddp-txt-sub-det\">16</span>#POW(4, 2) = <span class=\"ddp-txt-sub-det\">16</span>#POW(1.23, 3) = <span class=\"ddp-txt-sub-det\">1.8608669999999998</span>#POW(90, -2) = <span class=\"ddp-txt-sub-det\">1.234567901234568E-4</span>"
46,PAGE-CALCULATION,MATH,MATH FIELD,MATH FUNCTION,SCALB,1,Y,0,"2의 exponent 승의 값에다, 플로팅 포인트값인 number를 곱한 결과를 반환한다.","SCALB(number, exponent)","number: 임의의 실수를 나타냅니다.#exponent: 밑수 2에 적용될 지수값입니다.","SCALB(2, 4) = <span class=\"ddp-txt-sub-det\">32</span>#SCALB(4, 2) = <span class=\"ddp-txt-sub-det\">16</span>#SCALB(1.23, 3) = <span class=\"ddp-txt-sub-det\">9.84</span>#SCALB(90, -2) = <span class=\"ddp-txt-sub-det\">22.5</span>","Returns the result of multiplying a floating point value number by an exponent of 2.","number: Indicates any error.#exponent: Exponential value to be applied to base 2.","SCALB(2, 4) = <span class=\"ddp-txt-sub-det\">32</span>#SCALB(4, 2) = <span class=\"ddp-txt-sub-det\">16</span>#SCALB(1.23, 3) = <span class=\"ddp-txt-sub-det\">9.84</span>#SCALB(90, -2) = <span class=\"ddp-txt-sub-det\">22.5</span>"
47,PAGE-CALCULATION,LOGICAL,LOGICAL FIELD,LOGICAL FUNCTION,IF,1,Y,0,"논리 검사를 수행하여 TRUE나 FALSE에 해당하는 값을 반환합니다.","IF(logical_test, value_if_true, value_if_false)","logical_test: TRUE나 FALSE로 판정될 값이나 식입니다.#value_if_true: logical_test가 TRUE일 때 돌려주는 값입니다. 생략하면 TRUE를 반환합니다. IF 함수를 일곱 번 중첩해서 쓸 수 있습니다.#value_if_false: logical_test가 FALSE일 때 돌려주는 값입니다. 생략하면 FALSE를 반환합니다.","IF('TRUE', 10, -10) = <span class=\"ddp-txt-sub-det\">10</span>#IF('FALSE', 10, -10) = <span class=\"ddp-txt-sub-det\">-10</span>","Perform a logical check to return a value that corresponds to TRUE or FALSE.","logical_test: The value or expression to be determined as TRUE or FALSE.#value_if_true: value returned when logical_test is TRUE. Returns TRUE if omitted. You can overlay the IF function seven times.#value_if_false: The value returned when logical_test is FALSE. If omitted, returns FALSE.","IF('TRUE', 10, -10) = <span class=\"ddp-txt-sub-det\">10</span>#IF('FALSE', 10, -10) = <span class=\"ddp-txt-sub-det\">-10</span>"
48,PAGE-CALCULATION,TYPE_CONVERT,TYPE_CONVERT FIELD,TYPE_CONVERT FUNCTION,CAST,1,Y,0,"지정한 타입으로 값을 변환하여 반환합니다.","CAST(parameta, type)","parameta: 변환할 대상이 되는 문자열 혹은 숫자입니다.#type: 'FLOAT', 'DOUBLE', 'LONG', 'STRING', 'DATETIME' 중 하나로 변환할 타입입니다.","CAST('100.123', 'DOUBLE') = <span class=\"ddp-txt-sub-det\">100.123</span>#CAST(TIMESTAMP('2016-01-01T10:10:10'), 'DATETIME') = <span class=\"ddp-txt-sub-det\">'2016-01-01T10:10:10.000Z'</span>#CAST(1234, 'STRING') = <span class=\"ddp-txt-sub-det\"> '1234'</span>#CAST('100', 'LONG') = <span class=\"ddp-txt-sub-det\">100</span>","Convert and return the value to the specified type.","parameta: The string or number to be converted to.#type: Type to convert to one of 'FLOAT', 'DOUBLE', 'LONG', 'STRING', or 'DATETIME'.","CAST('100.123', 'DOUBLE') = <span class=\"ddp-txt-sub-det\">100.123</span>#CAST(TIMESTAMP('2016-01-01T10:10:10'), 'DATETIME') = <span class=\"ddp-txt-sub-det\">'2016-01-01T10:10:10.000Z'</span>#CAST(1234, 'STRING') = <span class=\"ddp-txt-sub-det\"> '1234'</span>#CAST('100', 'LONG') = <span class=\"ddp-txt-sub-det\">100</span>"
49,PAGE-CALCULATION,TYPE_CONVERT,TYPE_CONVERT FIELD,TYPE_CONVERT FUNCTION,TIMESTAMP,1,Y,0,"문자열 시간을 LONG 타입으로 변환합니다.","TIMESTAMP(datetime_string)#TIMESTAMP(datetime_string, format)#TIMESTAMP(datetime_string, format, timezone)#TIMESTAMP(datetime_string, format, timezone, locale)","datetime_string: 변환할 대상이 되는 날짜-시간을 표시하는 문자열입니다.#format: 입력된 문자열을 변환할 구조를 의미합니다. 입력이 없을 경우 'yyyy-MM-dd'T'HH:mm:ss[.SSS][ZZ]'가 적용됩니다.#timezone: 시간대입니다.#locale: 출력 언어입니다.","TIMESTAMP('2011-01-04T10:00:00') = <span class=\"ddp-txt-sub-det\">1294135200000</span>#TIMESTAMP('2013-05-04 20:20:00', 'yyyy-MM-dd HH:mm:ss') = <span class=\"ddp-txt-sub-det\">1367698800000</span>#CAST(TIMESTAMP('2015-02-04 23:00:00', 'yyyy-MM-dd HH:mm:ss'), 'DATETIME') = <span class=\"ddp-txt-sub-det\">'2015-02-04T23:00:00.000Z'</span>","Converts string time to LONG type.","datetime_string: A string that represents the date-time to be converted.#format: means the structure to convert the entered string. If no input is available, 'yyyy-MM-dd'T'HH:mm:ss[.SSS' applies.#timezone: Time zone.#locale: The output language.","TIMESTAMP('2011-01-04T10:00:00') = <span class=\"ddp-txt-sub-det\">1294135200000</span>#TIMESTAMP('2013-05-04 20:20:00', 'yyyy-MM-dd HH:mm:ss') = <span class=\"ddp-txt-sub-det\">1367698800000</span>#CAST(TIMESTAMP('2015-02-04 23:00:00', 'yyyy-MM-dd HH:mm:ss'), 'DATETIME') = <span class=\"ddp-txt-sub-det\">'2015-02-04T23:00:00.000Z'</span>"
50,PAGE-CALCULATION,TYPE_CONVERT,TYPE_CONVERT FIELD,TYPE_CONVERT FUNCTION,UNIX_TIMESTAMP,1,Y,0,"문자열 시간을 LONG 타입으로 변환합니다. TIMESTAMP()결과에 1000을 나눈값과 동일합니다.","UNIX_TIMESTAMP(datetime_string)#UNIX_TIMESTAMP(datetime_string, format)#TIMESTAMP(datetime_string, format, timezone)#TIMESTAMP(datetime_string, format, timezone, locale)","datetime_string: 변환할 대상이 되는 날짜-시간을 표시하는 문자열입니다.#format: 입력된 문자열을 변환할 구조를 의미합니다. 입력이 없을 경우 'yyyy-MM-dd'T'HH:mm:ss[.SSS][ZZ]'가 적용됩니다.#timezone: 시간대입니다.#locale: 출력 언어입니다.","UNIX_TIMESTAMP('2011-01-04T10:00:00') = <span class=\"ddp-txt-sub-det\">1294135200</span>#UNIX_TIMESTAMP('2013-05-04 20:20:00', 'yyyy-MM-dd HH:mm:ss') = <span class=\"ddp-txt-sub-det\">1367698800</span>#CAST(UNIX_TIMESTAMP('2015-02-04 23:00:00', 'yyyy-MM-dd HH:mm:ss')*1000, 'DATETIME') = <span class=\"ddp-txt-sub-det\">'2015-02-04T23:00:00.000Z'</span>","Converts string time to LONG type. TIMESTAMP() is the same as the result divided by 1000.","datetime_string: A string that represents the date-time to be converted.#format: means the structure to convert the entered string. If no input is available, 'yyyy-MM-dd'T'HH:mm:ss[.SSS' applies.#timezone: Time zone.#locale: The output language.","UNIX_TIMESTAMP('2011-01-04T10:00:00') = <span class=\"ddp-txt-sub-det\">1294135200</span>#UNIX_TIMESTAMP('2013-05-04 20:20:00', 'yyyy-MM-dd HH:mm:ss') = <span class=\"ddp-txt-sub-det\">1367698800</span>#CAST(UNIX_TIMESTAMP('2015-02-04 23:00:00', 'yyyy-MM-dd HH:mm:ss')*1000, 'DATETIME') = <span class=\"ddp-txt-sub-det\">'2015-02-04T23:00:00.000Z'</span>"
51,PAGE-CALCULATION,TYPE_CONVERT,TYPE_CONVERT FIELD,TYPE_CONVERT FUNCTION,TIME_FORMAT,1,Y,0,"시간을 지정한 구조에 따라 변환하여 문자열로 반환합니다.","TIME_FORMAT(datetime, out.format = , out.timezone = , out.locale =)","datetime: 변환할 대상이 되는 날짜-시간입니다.#out.format : 입력된 문자열을 변환할 구조를 의미합니다.#out.timezone : 입력된 문자열을 변환할 timezone을 의미합니다.#out.locale: 입력된 문자열을 변환할 지역을 의미합니다.","TIME_FORMAT(TIMESTAMP('2016-01-01T10:10:10'), out.format='yyyy-MM-dd') = <span class=\"ddp-txt-sub-det\">'2016-01-01'</span>#TIME_FORMAT(now(), out.format='yyyy-MM-dd EEEEEE', out.locale='ko') = <span class=\"ddp-txt-sub-det\">'2018-06-26 화요일'</span>#TIME_FORMAT('2016-01-01T10:10:10', out.format='yyyy-MM-dd') = <span class=\"ddp-txt-sub-det\">'2016-01-01'</span>#TIME_FORMAT(now(), 'yyyy-MM-dd EEEEEE', 'Asia/Seoul', 'ko') = <span class=\"ddp-txt-sub-det\">'2018-06-26 화요일'</span>","Converts the time according to the specified structure and returns it to a string.","datetime: Date-time to convert.#out.format : means the structure to convert the entered string.#out.timezone : means the timezone to convert the entered string.#out.locale: means the region where you want to convert the entered string.","TIME_FORMAT(TIMESTAMP('2016-01-01T10:10:10'), out.format='yyyy-MM-dd') = <span class=\"ddp-txt-sub-det\">'2016-01-01'</span>#TIME_FORMAT(now(), out.format='yyyy-MM-dd EEEEEE', out.locale='ko') = <span class=\"ddp-txt-sub-det\">'2018-06-26 화요일'</span>#TIME_FORMAT('2016-01-01T10:10:10', out.format='yyyy-MM-dd') = <span class=\"ddp-txt-sub-det\">'2016-01-01'</span>#TIME_FORMAT(now(), 'yyyy-MM-dd EEEEEE', 'Asia/Seoul', 'ko') = <span class=\"ddp-txt-sub-det\">'2018-06-26 화요일'</span>"
52,PAGE-CALCULATION,LOGICAL,LOGICAL FIELD,LOGICAL FUNCTION,ISNULL,1,Y,0,"대상의 값이 NULL인 경우 1을 NULL이 아닌 경우 0을 반환합니다.","ISNULL(expr)","expr: null을 포함할 수 있는 값 또는 표현식입니다.","ISNULL('abc') = <span class=\"ddp-txt-sub-det\">0</span>#ISNULL('')= <span class=\"ddp-txt-sub-det\">1</span>#ISNULL(REGEX('Technology' , 'F.*')) = <span class=\"ddp-txt-sub-det\">1</span>","Returns 0 if the target's value is NULL, if 1 is not NULL.","expr: value or expression that can contain null.","ISNULL('abc') = <span class=\"ddp-txt-sub-det\">0</span>#ISNULL('')= <span class=\"ddp-txt-sub-det\">1</span>#ISNULL(REGEX('Technology' , 'F.*')) = <span class=\"ddp-txt-sub-det\">1</span>"
53,PAGE-CALCULATION,LOGICAL,LOGICAL FIELD,LOGICAL FUNCTION,NVL,1,Y,0,"대상의 값이 NULL인 경우 지정된 값을 반환하고 NULL이 아닌 경우 대상의 값을 반환합니다.","NVL(expr1, expr2)","expr1: null을 포함할 수 있는 값 또는 표현식입니다.#expr2: null을 변환하기 위한 대상값입니다.","NVL('', 10) = <span class=\"ddp-txt-sub-det\">10</span>#NVL('abc', 10) = <span class=\"ddp-txt-sub-det\">'abc'</span>#NVL('', '123') = <span class=\"ddp-txt-sub-det\">'123'</span>","Returns the specified value if the value of the target is NULL and the value of the target if it is not NULL.","expr1: Value or expression that can contain null.#expr2: Target value for converting null.","NVL('', 10) = <span class=\"ddp-txt-sub-det\">10</span>#NVL('abc', 10) = <span class=\"ddp-txt-sub-det\">'abc'</span>#NVL('', '123') = <span class=\"ddp-txt-sub-det\">'123'</span>"
55,PAGE-CALCULATION,TIME,TIME FIELD,TIME FUNCTION,DATEDIFF,1,Y,0,"두 날짜-시간의 날(day)의 차이를 반환합니다.","DATEDIFF(start_datetime, end_datetime)","start_datetime: 시작 날짜-시간입니다.#end_datetime: 끝 날짜-시간입니다.","DATEDIFF('2011-01-04 00:00:00', '2011-01-05 00:00:00') = <span class=\"ddp-txt-sub-det\">1</span>#DATEDIFF('2011-01-06 00:00:00', '2011-01-05 00:00:00') = <span class=\"ddp-txt-sub-det\">-1</span>#DATEDIFF('2011-01-04 00:00:00', __time) = <span class=\"ddp-txt-sub-det\">timestamp field에서 '2011-01-04 00:00:00'를 뺀 차이를 날수(day)로 반환</span>","Returns the difference between two date-time days.","start_datetime: start date-time.#end_datetime: End date-time.","DATEDIFF('2011-01-04 00:00:00', '2011-01-05 00:00:00') = <span class=\"ddp-txt-sub-det\">1</span>#DATEDIFF('2011-01-06 00:00:00', '2011-01-05 00:00:00') = <span class=\"ddp-txt-sub-det\">-1</span>#DATEDIFF('2011-01-04 00:00:00', __time) = <span class=\"ddp-txt-sub-det\">Timeestamp field minus '2011-01-04 00:00:00' returns in days</span>"
56,PAGE-CALCULATION,LOGICAL,LOGICAL FIELD,LOGICAL FUNCTION,SWITCH,1,Y,0,"필드와 값을 비교하여 조건에 해당하는 값을 반환합니다.","SWITCH(dimesion_name , string1, string1_value, string2, string2_value, …., else_value)","dimesion_name: 조건을 확인할 대상 필드입니다.#string1: 필드와 비교할 값입니다.#string1_value: string1 이 필드 값과 같은 경우 반환할 값입니다.#string2: 필드와 비교할 값입니다.#string2_value: string2 이 필드 값과 같은 경우 반환할 값입니다.#else_value: 모든 조건이 만족하지 않은 경우 반환할 값입니다.","SWITCH('TEST01', 'TEST01', 10, 'TEST02', 20, 30) = <span class=\"ddp-txt-sub-det\">10</span>#SWITCH('TEST02', 'TEST01', 10, 'TEST02', 20, 30) = <span class=\"ddp-txt-sub-det\">20</span>#SWITCH('TEST03', 'TEST01', 10, 'TEST02', 20, 30) = <span class=\"ddp-txt-sub-det\">30</span>#SWITCH([Category] , 'Furniture', 1, 'Office Supplies', 2, 0) = <span class=\"ddp-txt-sub-det\">category가 Furniture이면 1 Office Supplies이면 2 모두 아니면 0을 반환</span>","Compare the field with the value to return the value corresponding to the condition.","dimesion_name: The field to which you want to view the condition.#string1: Value to compare with field.#string1_value: string1 The value to return if this field value is the same.#string2: Value to compare with field.#string2_value: string2 The value to return if this field value is the same.#else_value: The value to return if all conditions are not met.","SWITCH('TEST01', 'TEST01', 10, 'TEST02', 20, 30) = <span class=\"ddp-txt-sub-det\">10</span>#SWITCH('TEST02', 'TEST01', 10, 'TEST02', 20, 30) = <span class=\"ddp-txt-sub-det\">20</span>#SWITCH('TEST03', 'TEST01', 10, 'TEST02', 20, 30) = <span class=\"ddp-txt-sub-det\">30</span>#SWITCH([Category] , 'Furniture', 1, 'Office Supplies', 2, 0) = <span class=\"ddp-txt-sub-det\">If the category is Furniture, if 1 Office Supplies, return 0 if not both.</span>"
57,PAGE-CALCULATION,LOGICAL,LOGICAL FIELD,LOGICAL FUNCTION,CASE,1,Y,0,"논리 검사를 수행하여 TRUE에 해당하는 값을 반환합니다.","CASE(logical_test1, value_if_true1, logical_test2, value_if_true2, …., else_value)","logical_test1: TRUE나 FALSE로 판정될 값이나 식입니다.#value_if_true1: logical_test1가 TRUE일 때 돌려주는 값입니다.#logical_test2: TRUE나 FALSE로 판정될 값이나 식입니다.#value_if_true2: logical_test2가 TRUE일 때 돌려주는 값입니다#else_value: 모든 조건이 만족하지 않은 경우 반환할 값입니다.","CASE('TEST01' == 'TEST01', 10, 'TEST01' == 'TEST02', 20, 30) = <span class=\"ddp-txt-sub-det\">10</span>#CASE('TEST02' == 'TEST01', 10, 'TEST02' == 'TEST02', 20, 30) = <span class=\"ddp-txt-sub-det\">20</span>#CASE('TEST03' == 'TEST01', 10, 'TEST03' == 'TEST02', 20, 30) = <span class=\"ddp-txt-sub-det\">30</span>#CASE([Category] == 'Furniture', 1, Category == ''Office Supplies'', 2, 0) = <span class=\"ddp-txt-sub-det\">category가 Furniture이면 1 Office Supplies이면 2 모두 아니면 0을 반환</span>","Perform a logical check to return the value corresponding to TRUE.","logical_test1: The value or expression to be determined as TRUE or FALSE.#value_if_true1: The value returned when logical_test1 is TRUE.#logical_test2: The value or expression that will be determined as TRUE or FALSE.#value_if_true2: value returned when logical_test2 is TRUE#else_value: The value to return if all conditions are not met.","CASE('TEST01' == 'TEST01', 10, 'TEST01' == 'TEST02', 20, 30) = <span class=\"ddp-txt-sub-det\">10</span>#CASE('TEST02' == 'TEST01', 10, 'TEST02' == 'TEST02', 20, 30) = <span class=\"ddp-txt-sub-det\">20</span>#CASE('TEST03' == 'TEST01', 10, 'TEST03' == 'TEST02', 20, 30) = <span class=\"ddp-txt-sub-det\">30</span>#CASE([Category] == 'Furniture', 1, Category == ''Office Supplies'', 2, 0) = <span class=\"ddp-txt-sub-det\">Category is Furniture, 1 Office Supplies returns both or zero.</span>"
59,PAGE-CALCULATION,STRING,STRING FIELD,STRING FUNCTION,CONCAT,1,Y,0,"여러 텍스트를 한 텍스트로 조인시킵니다.","CONCAT(text1, text2,...)","text1: text1,text2,... 하나로 조인할 텍스트들 입니다.#text2: text1,text2,... 하나로 조인할 텍스트들 입니다.","CONCAT(\"Category\" , '::', \"Sub-Category\")</span>","Joins multiple text into one text.","text1: text1,text2,... text to join as one.#text2: text1,text2,... text to join as one.","CONCAT(\"Category\" , '::', \"Sub-Category\")</span>"
60,PAGE-CALCULATION,STRING,STRING FIELD,STRING FUNCTION,FORMAT,1,Y,0,"지정된 위치에 값을 대입해서 문자열을 만들어 반환합니다.","FORMAT(format, formatArg1,...)","format: 생성될 문자열의 정보를 가지고 있는 텍스트입니다.#formatArg1: formatArg1,… 생성될 문자열에 포함될 값들입니다.","FORMAT('abc') = <span class=\"ddp-txt-sub-det\">'abc'</span>#FORMAT('abc-%s-%d', '123', 123) = <span class=\"ddp-txt-sub-det\">'abc-123-123'</span>#FORMAT('abc-%03d-%f', 12, 123.0) = <span class=\"ddp-txt-sub-det\">'abc-012-123.000000'</span>","Creates and returns a string by substituting a value for the specified location.","format: text with information in the string to be generated.#formatArg1: formatArg1,... Values to be included in the string to be generated.","FORMAT('abc') = <span class=\"ddp-txt-sub-det\">'abc'</span>#FORMAT('abc-%s-%d', '123', 123) = <span class=\"ddp-txt-sub-det\">'abc-123-123'</span>#FORMAT('abc-%03d-%f', 12, 123.0) = <span class=\"ddp-txt-sub-det\">'abc-012-123.000000'</span>"
61,PAGE-CALCULATION,STRING,STRING FIELD,STRING FUNCTION,LPAD,1,Y,0,"입력된 문자열의 길이가 부족한 만큼 왼쪽에 지정된 문자를 추가한 문자를 반환한다.","LPAD(text, length, character)","text: 대상이 되는 문자열입니다.#length: 반환하고자하는 문자열의 길이입니다.#character: 부족한 부분을 채워 넣을 문자입니다.","LPAD('123', 10, '0') = <span class=\"ddp-txt-sub-det\">'0000000123'</span>#LPAD('abc', 2, '0') = <span class=\"ddp-txt-sub-det\">'abc'</span>#LPAD('abc', 5, '_') = <span class=\"ddp-txt-sub-det\">'__abc'</span>","Returns the character that adds the specified character to the left as the length of the entered string is insufficient.","text: The string to be targeted.#length: length of string to be returned.#character: character to fill out the missing part.","LPAD('123', 10, '0') = <span class=\"ddp-txt-sub-det\">'0000000123'</span>#LPAD('abc', 2, '0') = <span class=\"ddp-txt-sub-det\">'abc'</span>#LPAD('abc', 5, '_') = <span class=\"ddp-txt-sub-det\">'__abc'</span>"
62,PAGE-CALCULATION,STRING,STRING FIELD,STRING FUNCTION,RPAD,1,Y,0,"입력된 문자열의 길이가 부족한 만큼 오른쪽에 지정된 문자를 추가한 문자를 반환한다.","RPAD(text, length, character)","text: 대상이 되는 문자열입니다.#length: 반환하고자하는 문자열의 길이입니다.#character: 부족한 부분을 채워 넣을 문자입니다.","RPAD('123', 10, '0') = <span class=\"ddp-txt-sub-det\">'1230000000'</span>#RPAD('abc', 2, '0') = <span class=\"ddp-txt-sub-det\">'abc'</span>#RPAD('abc', 5, '_') = <span class=\"ddp-txt-sub-det\">'abc__'</span>","Returns the character that adds the specified character to the right as the length of the entered string is insufficient.","text: The string to be targeted.#length: length of string to be returned.#character: character to fill out the missing part.","RPAD('123', 10, '0') = <span class=\"ddp-txt-sub-det\">'1230000000'</span>#RPAD('abc', 2, '0') = <span class=\"ddp-txt-sub-det\">'abc'</span>#RPAD('abc', 5, '_') = <span class=\"ddp-txt-sub-det\">'abc__'</span>"
