id,categoryCode,commonCode,categoryCommonCodeNm,commonCodeNm,commonValue,commonCodeSNO,commonUseFl,version,description,syntax,param,example,descriptionEn,paramEn,exampleEn
4,PAGE-CALCULATION,ETC,ETC FIELD,ETC FUNCTION,SIZE,1,Y,0,"collection의 크기를 반환합니다.","SIZE(collection)","collection: 대상이 되는 array 입니다.","SIZE(ARRAY('1', '2', '3', '4')) = <span class=\"ddp-txt-sub-det\">4</span>","Returns the size of the collection.","Collection: This is the array to be targeted.","SIZE(ARRAY('1', '2', '3', '4')) = <span class=\"ddp-txt-sub-det\">4</span>"
5,PAGE-CALCULATION,TYPE_CONVERT,TYPE_CONVERT FIELD,TYPE_CONVERT FUNCTION,ARRAY,1,Y,0,"주어진 값들을 array(collection)의 형태로 반환합니다.","ARRAY(value1, value2,...)","value1: value1,value2,... 대상이 되는 값들입니다.","ARRAY('1', '2', '3', '4') = <span class=\"ddp-txt-sub-det\">[ 1.0, 2.0, 3.0, 4.0 ]</span>","Returns the given values in the form of array(collection).","value1: value1,value2,... These are the values","ARRAY('1', '2', '3', '4') = <span class=\"ddp-txt-sub-det\">[ 1.0, 2.0, 3.0, 4.0 ]</span>"
6,PAGE-CALCULATION,STRING,STRING FIELD,STRING FUNCTION,LIKE,1,Y,0,"search_text으로 match를 확인하여 boolean 으로 반환합니다.","LIKE(text , search_text)","text: 대상이 되는 텍스트 문자열입니다.#search_text: 찾고자하는 문자열입니다.","LIKE('Funiture' , 'F%') = <span class=\"ddp-txt-sub-det\">True</span>#LIKE('Technology' , '%gy') = <span class=\"ddp-txt-sub-det\">True</span>#LIKE('Technology' , '%nol%') = <span class=\"ddp-txt-sub-det\">True</span>","Check the match with search_text and return it to Boolean .","text: The text string to which it is targeted.#search_text: The string you want to find.","LIKE('Funiture' , 'F%') = <span class=\"ddp-txt-sub-det\">True</span>#LIKE('Technology' , '%gy') = <span class=\"ddp-txt-sub-det\">True</span>#LIKE('Technology' , '%nol%') = <span class=\"ddp-txt-sub-det\">True</span>"
7,PAGE-CALCULATION,STRING,STRING FIELD,STRING FUNCTION,REGEX,1,Y,0,"regex_text으로 match를 확인하여 matching된 문자열을 반환한다. 그룹화한 경우 index를 통해 원하는 위치의 문자열을 반환할 수 있다.","REGEX(text , regex_text)#REGEX(text , regex_text, index)","text: 대상이 되는 텍스트 문자열입니다.#regex_text: 찾고자하는 정규 표현식 문자열입니다.#index: regex_text를 통해 그룹화한 경우 반환할 그룹위치입니다. 0이면 전체를 반환합니다.","REGEX('Funiture' , 'F.*') = <span class=\"ddp-txt-sub-det\">'Funiture'</span>#REGEX('Funiture' , 'tu.*') = <span class=\"ddp-txt-sub-det\">'ture'</span>#REGEX('Technology' , 'F.*') = <span class=\"ddp-txt-sub-det\">'null'</span>#REGEX('ABC3000EFG' , '(.*?)(\\\d+)(.*)', 3) = <span class=\"ddp-txt-sub-det\">'EFG'</span>","Check match with regex_text to return the matching string. If grouped, index allows you to return a string at the desired location.","text: The text string to which it is targeted.#regex_text: The regular expression string you want to find.#index: The group location to return if grouped through regex_text. If 0 then returns the whole.","REGEX('Funiture' , 'F.*') = <span class=\"ddp-txt-sub-det\">'Funiture'</span>#REGEX('Funiture' , 'tu.*') = <span class=\"ddp-txt-sub-det\">'ture'</span>#REGEX('Technology' , 'F.*') = <span class=\"ddp-txt-sub-det\">'null'</span>#REGEX('ABC3000EFG' , '(.*?)(\\\d+)(.*)', 3) = <span class=\"ddp-txt-sub-det\">'EFG'</span>"
11,PAGE-CALCULATION,MATH,MATH FIELD,MATH FUNCTION,ABS,1,Y,0,"기호가 없는 수의 절대 값을 반환합니다.","ABS(number)","number: 절대 값을 구하려는 실수입니다.","ABS(-10) = <span class=\"ddp-txt-sub-det\">10</span>#ABS(10) = <span class=\"ddp-txt-sub-det\">10</span>","Returns the absolute value of a number without a symbol.","number: The mistake of trying to get an absolute value.","ABS(-10) = <span class=\"ddp-txt-sub-det\">10</span>#ABS(10) = <span class=\"ddp-txt-sub-det\">10</span>"
12,PAGE-CALCULATION,MATH,MATH FIELD,MATH FUNCTION,ACOS,1,Y,0,"아크코사인 값을 구합니다.","ACOS(number)","number: 구하려는 각도의 코사인 값으로 -1에서 1 사이 값이어야 합니다.","ACOS(-1) = <span class=\"ddp-txt-sub-det\">3.141592653589793</span>","Obtain the arccosine value.","number: The cosine value for the angle you want to obtain must be between -1 and 1.","ACOS(-1) = <span class=\"ddp-txt-sub-det\">3.141592653589793</span>"
13,PAGE-CALCULATION,MATH,MATH FIELD,MATH FUNCTION,ASIN,1,Y,0,"아크사인 값을 구합니다.","ASIN(number)","number: 구하려는 각도의 사인 값으로 -1에서 1 사이 값이어야 합니다.","ASIN(-1) = <span class=\"ddp-txt-sub-det\">-1.5707963267948966</span>","Obtain an arcsine value.","number: The sine value of the angle you want to obtain must be between -1 and 1.","ASIN(-1) = <span class=\"ddp-txt-sub-det\">-1.5707963267948966</span>"
14,PAGE-CALCULATION,MATH,MATH FIELD,MATH FUNCTION,ATAN,1,Y,0,"아크탄젠트 값을 구합니다.","ATAN(number)","number: 구하려는 각도의 탄젠트 값입니다.","ATAN(-1) = <span class=\"ddp-txt-sub-det\">-0.7853981633974483</span>","Obtain the value of the arctangent value.","number: the tangent value of the angle you want to obtain.","ATAN(-1) = <span class=\"ddp-txt-sub-det\">-0.7853981633974483</span>"
15,PAGE-CALCULATION,MATH,MATH FIELD,MATH FUNCTION,CBRT,1,Y,0,"밑수를 세제곱한 결과를 구합니다.","CBRT(number)","number: 밑수입니다.","CBRT(5) = <span class=\"ddp-txt-sub-det\">1.709975946676697</span>","Obtain the result of cubeing the base.","Number: Base.","CBRT(5) = <span class=\"ddp-txt-sub-det\">1.709975946676697</span>"
16,PAGE-CALCULATION,MATH,MATH FIELD,MATH FUNCTION,CEIL,1,Y,0,"1의 배수가 되도록 절대 값을 올림합니다.","CEIL(number)","number: 올림하려는 수입니다.","CEIL(1.234) = <span class=\"ddp-txt-sub-det\">2</span>#CEIL(123.4) = <span class=\"ddp-txt-sub-det\">124</span>#CEIL(1.00) = <span class=\"ddp-txt-sub-det\">1</span>#CEIL(-1.234) = <span class=\"ddp-txt-sub-det\">-1</span>","Raise the absolute value so that it is multiples of 1.","number: The number to be rounded up.","CEIL(1.234) = <span class=\"ddp-txt-sub-det\">2</span>#CEIL(123.4) = <span class=\"ddp-txt-sub-det\">124</span>#CEIL(1.00) = <span class=\"ddp-txt-sub-det\">1</span>#CEIL(-1.234) = <span class=\"ddp-txt-sub-det\">-1</span>"
17,PAGE-CALCULATION,MATH,MATH FIELD,MATH FUNCTION,COS,1,Y,0,"각도의 코사인 값을 반환합니다.","COS(number)","number: 코사인 값을 구하려는 라디안의 각도입니다.","COS(45) = <span class=\"ddp-txt-sub-det\">0.5253219888177297</span>#COS(10) = <span class=\"ddp-txt-sub-det\">-0.8390715290764524</span>#COS(-45) = <span class=\"ddp-txt-sub-det\">0.5253219888177297</span>#COS(90) = <span class=\"ddp-txt-sub-det\">-0.4480736161291702</span>","Returns the cosine value of the angle.","number: The angle in radians where you want to obtain the cosine value.","COS(45) = <span class=\"ddp-txt-sub-det\">0.5253219888177297</span>#COS(10) = <span class=\"ddp-txt-sub-det\">-0.8390715290764524</span>#COS(-45) = <span class=\"ddp-txt-sub-det\">0.5253219888177297</span>#COS(90) = <span class=\"ddp-txt-sub-det\">-0.4480736161291702</span>"
18,PAGE-CALCULATION,MATH,MATH FIELD,MATH FUNCTION,COSH,1,Y,0,"하이퍼볼릭 코사인 값을 반환합니다.","COSH(number)","number: 임의의 실수를 나타냅니다.","COSH(4) = <span class=\"ddp-txt-sub-det\">27.308232836016487</span>#COSH(1) = <span class=\"ddp-txt-sub-det\">1.543080634815244</span>#COSH(-4) = <span class=\"ddp-txt-sub-det\">27.308232836016487</span>#COSH(9) = <span class=\"ddp-txt-sub-det\">4051.5420254925943</span>","Returns the value of the hypervolatile cosine.","number: Indicates any error.","COSH(4) = <span class=\"ddp-txt-sub-det\">27.308232836016487</span>#COSH(1) = <span class=\"ddp-txt-sub-det\">1.543080634815244</span>#COSH(-4) = <span class=\"ddp-txt-sub-det\">27.308232836016487</span>#COSH(9) = <span class=\"ddp-txt-sub-det\">4051.5420254925943</span>"
19,PAGE-CALCULATION,MATH,MATH FIELD,MATH FUNCTION,EXP,1,Y,0,"number를 지수로 한 e의 누승을 계산합니다.","EXP(number)","number: 밑 e에 적용할 지수입니다. 상수 e는 자연 로그값의 밑인 2.71828182845904와 같습니다.","EXP(4) = <span class=\"ddp-txt-sub-det\">54.598150033144236</span>#EXP(1) = <span class=\"ddp-txt-sub-det\">2.718281828459045</span>#EXP(-4) = <span class=\"ddp-txt-sub-det\">0.01831563888873418</span>#EXP(9) = <span class=\"ddp-txt-sub-det\">8103.083927575384</span>","Calculates a leak in e with the number of index.","number: The index to be applied to the e below. The constant e is equal to 2.71828182845904 below the natural logarithmic value.","EXP(4) = <span class=\"ddp-txt-sub-det\">54.598150033144236</span>#EXP(1) = <span class=\"ddp-txt-sub-det\">2.718281828459045</span>#EXP(-4) = <span class=\"ddp-txt-sub-det\">0.01831563888873418</span>#EXP(9) = <span class=\"ddp-txt-sub-det\">8103.083927575384</span>"
20,PAGE-CALCULATION,MATH,MATH FIELD,MATH FUNCTION,EXPM1,1,Y,0,"number를 지수로 한 e의 누승에서 1을 뺀 값을 반환합니다.","EXPM1(number)","number: 밑 e에 적용할 지수입니다. 상수 e는 자연 로그값의 밑인 2.71828182845904와 같습니다.","EXP(4) = <span class=\"ddp-txt-sub-det\">53.598150033144236</span>#EXP(1) = <span class=\"ddp-txt-sub-det\">1.718281828459045</span>#EXP(-4) = <span class=\"ddp-txt-sub-det\">-0.9816843611112658</span>#EXP(9) = <span class=\"ddp-txt-sub-det\">8102.083927575384</span>","Returns the value of an e with a number minus 1 minus 1","number: The index to be applied to the e below. The constant e is equal to 2.71828182845904 below the natural logarithmic value.","EXP(4) = <span class=\"ddp-txt-sub-det\">53.598150033144236</span>#EXP(1) = <span class=\"ddp-txt-sub-det\">1.718281828459045</span>#EXP(-4) = <span class=\"ddp-txt-sub-det\">-0.9816843611112658</span>#EXP(9) = <span class=\"ddp-txt-sub-det\">8102.083927575384</span>"
21,PAGE-CALCULATION,MATH,MATH FIELD,MATH FUNCTION,FLOOR,1,Y,0,"1의 배수가 되도록 절대 값을 내림합니다.","FLOOR(number)","number: 내림하려는 수입니다.","FLOOR(1.234) = <span class=\"ddp-txt-sub-det\">1</span>#FLOOR(123.4) = <span class=\"ddp-txt-sub-det\">123</span>#FLOOR(1.00) = <span class=\"ddp-txt-sub-det\">1</span>#FLOOR(-1.234) = <span class=\"ddp-txt-sub-det\">-2</span>","Decrease the absolute value so that it is multiples of 1.","number: The number to be lowered.","FLOOR(1.234) = <span class=\"ddp-txt-sub-det\">1</span>#FLOOR(123.4) = <span class=\"ddp-txt-sub-det\">123</span>#FLOOR(1.00) = <span class=\"ddp-txt-sub-det\">1</span>#FLOOR(-1.234) = <span class=\"ddp-txt-sub-det\">-2</span>"
22,PAGE-CALCULATION,MATH,MATH FIELD,MATH FUNCTION,GETEXPONENT,1,Y,0,"부동 소수점의 표현으로 사용되는 불편 지수를 반환합니다.","GETEXPONENT(number)","number: 지수를 가져올 대상 실수입니다.","GETEXPONENT(8) = <span class=\"ddp-txt-sub-det\">3</span>#GETEXPONENT(5.36870912E8) = <span class=\"ddp-txt-sub-det\">29</span>#GETEXPONENT(1.00) = <span class=\"ddp-txt-sub-det\">0</span>#GETEXPONENT(-9) = <span class=\"ddp-txt-sub-det\">3</span>","Returns an unbiased index used as an expression of floating point","number: The destination error to import the index.","GETEXPONENT(8) = <span class=\"ddp-txt-sub-det\">3</span>#GETEXPONENT(5.36870912E8) = <span class=\"ddp-txt-sub-det\">29</span>#GETEXPONENT(1.00) = <span class=\"ddp-txt-sub-det\">0</span>#GETEXPONENT(-9) = <span class=\"ddp-txt-sub-det\">3</span>"
23,PAGE-CALCULATION,MATH,MATH FIELD,MATH FUNCTION,LOG,1,Y,0,"밑이 e인 로그값을 구합니다.","LOG(number)","number: 로그값을 구하려는 양의 실수입니다.","LOG(2.71828182846) = <span class=\"ddp-txt-sub-det\">1.0000000000003513</span>#LOG(10) = <span class=\"ddp-txt-sub-det\">2.302585092994046</span>#LOG(1.00) = <span class=\"ddp-txt-sub-det\">0</span>#LOG(-9) = <span class=\"ddp-txt-sub-det\">\"NaN\"</span>","Obtain a log value with the base e.","number: The amount of mistake you want to obtain the log value.","LOG(2.71828182846) = <span class=\"ddp-txt-sub-det\">1.0000000000003513</span>#LOG(10) = <span class=\"ddp-txt-sub-det\">2.302585092994046</span>#LOG(1.00) = <span class=\"ddp-txt-sub-det\">0</span>#LOG(-9) = <span class=\"ddp-txt-sub-det\">\"NaN\"</span>"
24,PAGE-CALCULATION,MATH,MATH FIELD,MATH FUNCTION,LOG10,1,Y,0,"밑이 10인 로그값을 구합니다.","LOG10(number)","number: 밑이 10인 로그값을 구하려는 양의 실수입니다.","LOG10(2.71828182846) = <span class=\"ddp-txt-sub-det\">0.43429448190340436</span>#LOG10(10) = <span class=\"ddp-txt-sub-det\">1</span>#LOG10(1.00) = <span class=\"ddp-txt-sub-det\">0</span>#LOG10(-9) = <span class=\"ddp-txt-sub-det\">\"NaN\"</span>","Obtain a log value of 10 below.","number: A positive error to obtain a log value of 10 below.","LOG10(2.71828182846) = <span class=\"ddp-txt-sub-det\">0.43429448190340436</span>#LOG10(10) = <span class=\"ddp-txt-sub-det\">1</span>#LOG10(1.00) = <span class=\"ddp-txt-sub-det\">0</span>#LOG10(-9) = <span class=\"ddp-txt-sub-det\">\"NaN\"</span>"
25,PAGE-CALCULATION,MATH,MATH FIELD,MATH FUNCTION,LOG1P,1,Y,0,"number에 1을 더한 로그값을 구합니다.","LOG1P(number)","number: 로그값을 구하려는 양의 실수입니다.","LOG1P(1.71828182846) = <span class=\"ddp-txt-sub-det\">1.0000000000003513</span>#LOG1P(10) = <span class=\"ddp-txt-sub-det\">2.3978952727983707</span>#LOG1P(1.00) = <span class=\"ddp-txt-sub-det\">0.6931471805599453</span>#LOG1P(-9) = <span class=\"ddp-txt-sub-det\">\"NaN\"</span>","Obtain a log value that adds 1 to the number.","number: The amount of mistake you want to obtain the log value.","LOG1P(1.71828182846) = <span class=\"ddp-txt-sub-det\">1.0000000000003513</span>#LOG1P(10) = <span class=\"ddp-txt-sub-det\">2.3978952727983707</span>#LOG1P(1.00) = <span class=\"ddp-txt-sub-det\">0.6931471805599453</span>#LOG1P(-9) = <span class=\"ddp-txt-sub-det\">\"NaN\"</span>"
26,PAGE-CALCULATION,MATH,MATH FIELD,MATH FUNCTION,NEXTUP,1,Y,0,"주어진 값 보다 큰 다음 부동 소수점 값을 반환합니다.","NEXTUP(number)","number: 임의의 실수를 나타냅니다.","NEXTUP(1.71828182846) = <span class=\"ddp-txt-sub-det\">1.7182818284600003</span>NEXTUP(10) = <span class=\"ddp-txt-sub-det\">10.000000000000002</span>#NEXTUP(1.00) = <span class=\"ddp-txt-sub-det\">1.0000000000000002</span>#NEXTUP(-9) = <span class=\"ddp-txt-sub-det\">-8.999999999999998</span>","Returns the next floating point value that is greater than the given value.","number: Indicates any error.","NEXTUP(1.71828182846) = <span class=\"ddp-txt-sub-det\">1.7182818284600003</span>NEXTUP(10) = <span class=\"ddp-txt-sub-det\">10.000000000000002</span>#NEXTUP(1.00) = <span class=\"ddp-txt-sub-det\">1.0000000000000002</span>#NEXTUP(-9) = <span class=\"ddp-txt-sub-det\">-8.999999999999998</span>"
27,PAGE-CALCULATION,MATH,MATH FIELD,MATH FUNCTION,RINT,1,Y,0,"인수와 가장 가까운 정수를 반환합니다.","RINT(number)","number: 임의의 실수를 나타냅니다.","RINT(123.45) = <span class=\"ddp-txt-sub-det\">123</span>#RINT(123.5) = <span class=\"ddp-txt-sub-det\">124</span>#RINT(1.00) = <span class=\"ddp-txt-sub-det\">1</span>#RINT(-123.45) = <span class=\"ddp-txt-sub-det\">-123</span>","Returns the integer closest to the argument.","number: Indicates any error.","RINT(123.45) = <span class=\"ddp-txt-sub-det\">123</span>#RINT(123.5) = <span class=\"ddp-txt-sub-det\">124</span>#RINT(1.00) = <span class=\"ddp-txt-sub-det\">1</span>#RINT(-123.45) = <span class=\"ddp-txt-sub-det\">-123</span>"
28,PAGE-CALCULATION,MATH,MATH FIELD,MATH FUNCTION,ROUND,1,Y,0,"인수를 반올림하여 반환합니다.","ROUND(number)","number: 반올림하려는 수입니다.","ROUND(123.45) = <span class=\"ddp-txt-sub-det\">123</span>ROUND(123.5) = <span class=\"ddp-txt-sub-det\">124</span>#ROUND(1.00) = <span class=\"ddp-txt-sub-det\">1</span>#ROUND(-123.45) = <span class=\"ddp-txt-sub-det\">-123</span>","Returns the argument by rounding","number: The number to round.","ROUND(123.45) = <span class=\"ddp-txt-sub-det\">123</span>ROUND(123.5) = <span class=\"ddp-txt-sub-det\">124</span>#ROUND(1.00) = <span class=\"ddp-txt-sub-det\">1</span>#ROUND(-123.45) = <span class=\"ddp-txt-sub-det\">-123</span>"
29,PAGE-CALCULATION,MATH,MATH FIELD,MATH FUNCTION,SIGNUM,1,Y,0,"인수의 부호 요소를 반환합니다.","SIGNUM(number)","number: 부호를 구할 실수입니다.","ROUND(123.45) = <span class=\"ddp-txt-sub-det\">1</span>#ROUND(1) = <span class=\"ddp-txt-sub-det\">1</span>#ROUND(0) = <span class=\"ddp-txt-sub-det\">0</span>#ROUND(-123.45) = <span class=\"ddp-txt-sub-det\">-1</span>","Returns the sign element of the argument.","number: Mistake to get the code.","ROUND(123.45) = <span class=\"ddp-txt-sub-det\">1</span>#ROUND(1) = <span class=\"ddp-txt-sub-det\">1</span>#ROUND(0) = <span class=\"ddp-txt-sub-det\">0</span>#ROUND(-123.45) = <span class=\"ddp-txt-sub-det\">-1</span>"
30,PAGE-CALCULATION,MATH,MATH FIELD,MATH FUNCTION,SIN,1,Y,0,"각도의 사인 값을 반환합니다.","SIN(number)","number: 사인 값을 구하려는 라디안의 각도입니다. 각도 * PI()/180 = 라디안입니다.","SIN(45) = <span class=\"ddp-txt-sub-det\">0.8509035245341184</span>#SIN(10) = <span class=\"ddp-txt-sub-det\">-0.5440211108893698</span>#SIN(-45) = <span class=\"ddp-txt-sub-det\">-0.8509035245341184</span>#SIN(90) = <span class=\"ddp-txt-sub-det\">0.8939966636005579</span>","Returns the sine value of the angle.","number: The angle in the radians where you want to obtain the sine value. Angle * PI()/180 = radians.","SIN(45) = <span class=\"ddp-txt-sub-det\">0.8509035245341184</span>#SIN(10) = <span class=\"ddp-txt-sub-det\">-0.5440211108893698</span>#SIN(-45) = <span class=\"ddp-txt-sub-det\">-0.8509035245341184</span>#SIN(90) = <span class=\"ddp-txt-sub-det\">0.8939966636005579</span>"
31,PAGE-CALCULATION,MATH,MATH FIELD,MATH FUNCTION,SINH,1,Y,0,"하이퍼볼릭 사인 값을 반환합니다.","SINH(number)","number: 임의의 실수를 나타냅니다.","SINH(4) = <span class=\"ddp-txt-sub-det\">27.308232836016487</span>#SINH(1) = <span class=\"ddp-txt-sub-det\">1.1752011936438014</span>#SINH(-4) = <span class=\"ddp-txt-sub-det\">-27.28991719712775</span>#SINH(9) = <span class=\"ddp-txt-sub-det\">4051.54190208279</span>","Returns the value of a hypervolatile sine.","number: Indicates any error.","SINH(4) = <span class=\"ddp-txt-sub-det\">27.308232836016487</span>#SINH(1) = <span class=\"ddp-txt-sub-det\">1.1752011936438014</span>#SINH(-4) = <span class=\"ddp-txt-sub-det\">-27.28991719712775</span>#SINH(9) = <span class=\"ddp-txt-sub-det\">4051.54190208279</span>"
32,PAGE-CALCULATION,MATH,MATH FIELD,MATH FUNCTION,SQRT,1,Y,0,"수의 제곱근을 반환합니다.","SQRT(number)","number: 제곱근을 반환하려는 수를 나타냅니다.","SQRT(4) = <span class=\"ddp-txt-sub-det\">2.0</span>#SQRT(1.234) = <span class=\"ddp-txt-sub-det\">1.1108555261599053</span>#SQRT(-4) = <span class=\"ddp-txt-sub-det\">\"NaN\"</span>#SQRT(9) = <span class=\"ddp-txt-sub-det\">3.0</span>","Returns the square root of the number.","number: Indicates the number of times you want to return the square root.","SQRT(4) = <span class=\"ddp-txt-sub-det\">2.0</span>#SQRT(1.234) = <span class=\"ddp-txt-sub-det\">1.1108555261599053</span>#SQRT(-4) = <span class=\"ddp-txt-sub-det\">\"NaN\"</span>#SQRT(9) = <span class=\"ddp-txt-sub-det\">3.0</span>"
33,PAGE-CALCULATION,MATH,MATH FIELD,MATH FUNCTION,TAN,1,Y,0,"각도의 탄젠트 값을 반환합니다.","TAN(number)","number: 탄젠트 값을 구할 라디안의 각도입니다. 각도 * PI()/180 = 라디안입니다.","TAN(45) = <span class=\"ddp-txt-sub-det\">1.6197751905438615</span>#TAN(10) = <span class=\"ddp-txt-sub-det\">0.6483608274590866</span>#TAN(-45) = <span class=\"ddp-txt-sub-det\">-1.6197751905438615</span>#TAN(90) = <span class=\"ddp-txt-sub-det\">-1.995200412208242</span>","Returns the tangent value of the angle.","number: The angle in radians where the tangent value will be obtained. Angle * PI()/180 = radians.","TAN(45) = <span class=\"ddp-txt-sub-det\">1.6197751905438615</span>#TAN(10) = <span class=\"ddp-txt-sub-det\">0.6483608274590866</span>#TAN(-45) = <span class=\"ddp-txt-sub-det\">-1.6197751905438615</span>#TAN(90) = <span class=\"ddp-txt-sub-det\">-1.995200412208242</span>"
34,PAGE-CALCULATION,MATH,MATH FIELD,MATH FUNCTION,TANH,1,Y,0,"하이퍼볼릭 탄젠트 값을 반환합니다.","TANH(number)","number: 임의의 실수를 나타냅니다.","TANH(4) = <span class=\"ddp-txt-sub-det\">0.999329299739067</span>#TANH(1) = <span class=\"ddp-txt-sub-det\">0.7615941559557649</span>#TANH(-4) = <span class=\"ddp-txt-sub-det\">-0.999329299739067</span>#TANH(9) = <span class=\"ddp-txt-sub-det\">0.999999969540041</span>","Returns the value of the hypervolatile tangent.","number: Indicates any error.","TANH(4) = <span class=\"ddp-txt-sub-det\">0.999329299739067</span>#TANH(1) = <span class=\"ddp-txt-sub-det\">0.7615941559557649</span>#TANH(-4) = <span class=\"ddp-txt-sub-det\">-0.999329299739067</span>#TANH(9) = <span class=\"ddp-txt-sub-det\">0.999999969540041</span>"
35,PAGE-CALCULATION,MATH,MATH FIELD,MATH FUNCTION,TODEGREES,1,Y,0,"라디안 형태의 각도를 도 단위로 바꿉니다.","DEGREES(angle)","angle: 변환하려는 라디안 형태의 각도입니다.","TODEGREES(TORADIANS(45)) = <span class=\"ddp-txt-sub-det\">45</span>#TODEGREES(TORADIANS(1)) = <span class=\"ddp-txt-sub-det\">1</span>#TODEGREES(TORADIANS(-45)) = <span class=\"ddp-txt-sub-det\">-45</span>#TODEGREES(TORADIANS(90)) = <span class=\"ddp-txt-sub-det\">90</span>","Change the radians-type angle in degrees.","angle: the angle of the radian form you want to convert.","TODEGREES(TORADIANS(45)) = <span class=\"ddp-txt-sub-det\">45</span>#TODEGREES(TORADIANS(1)) = <span class=\"ddp-txt-sub-det\">1</span>#TODEGREES(TORADIANS(-45)) = <span class=\"ddp-txt-sub-det\">-45</span>#TODEGREES(TORADIANS(90)) = <span class=\"ddp-txt-sub-det\">90</span>"
36,PAGE-CALCULATION,MATH,MATH FIELD,MATH FUNCTION,TORADIANS,1,Y,0,"도 단위로 표시된 각도를 라디안으로 변환합니다.","RADIANS(angle)","angle: 라디안으로 변환할 각도입니다.","TORADIANS(45) = <span class=\"ddp-txt-sub-det\">0.7853981633974483</span>#TORADIANS(1) = <span class=\"ddp-txt-sub-det\">0.017453292519943295</span>#TORADIANS(-45) = <span class=\"ddp-txt-sub-det\">-0.7853981633974483</span>#TORADIANS(90) = <span class=\"ddp-txt-sub-det\">1.5707963267948966</span>","Converts the angle displayed in degrees into radians.","angle: the angle to be converted into radians.","TORADIANS(45) = <span class=\"ddp-txt-sub-det\">0.7853981633974483</span>#TORADIANS(1) = <span class=\"ddp-txt-sub-det\">0.017453292519943295</span>#TORADIANS(-45) = <span class=\"ddp-txt-sub-det\">-0.7853981633974483</span>#TORADIANS(90) = <span class=\"ddp-txt-sub-det\">1.5707963267948966</span>"
37,PAGE-CALCULATION,MATH,MATH FIELD,MATH FUNCTION,ULP,1,Y,0,"인수의 ulp의 사이즈를 돌려줍니다. 부동 소수점 값의 ULP이 부동 소수점 값과 다음에 큰 절대치 실수 값의 포지티브 거리이다.","ULP(number)","number: 임의의 실수를 나타냅니다.","ULP(123.456) = <span class=\"ddp-txt-sub-det\">1.4210854715202004E-14</span>#ULP(1) = <span class=\"ddp-txt-sub-det\">2.220446049250313E-16</span>#ULP(-45) = <span class=\"ddp-txt-sub-det\">7.105427357601002E-15</span>#ULP(90) = <span class=\"ddp-txt-sub-det\">1.4210854715202004E-14</span>","Returns the size of the argument's pulp. The ULP of a floating point value is the positive distance between the floating point value and the absolute value of the next large error.","number: Indicates any error.","ULP(123.456) = <span class=\"ddp-txt-sub-det\">1.4210854715202004E-14</span>#ULP(1) = <span class=\"ddp-txt-sub-det\">2.220446049250313E-16</span>#ULP(-45) = <span class=\"ddp-txt-sub-det\">7.105427357601002E-15</span>#ULP(90) = <span class=\"ddp-txt-sub-det\">1.4210854715202004E-14</span>"
38,PAGE-CALCULATION,MATH,MATH FIELD,MATH FUNCTION,ATAN2,1,Y,0,"-Pi에서 Pi까지의 라디안에서 지정된 x, y 좌표의 아크탄젠트 값을 구합니다. 단 -Pi 값은 제외됩니다.","ATAN2(x_num, y_num)","x_num: 각을 구하려는 지점의 x 좌표입니다.#y_num: 각을 구하려는 지점의 y 좌표입니다.","ATAN2(90, 0) = <span class=\"ddp-txt-sub-det\">1.5707963267948966</span>#ATAN2(0, 90) = <span class=\"ddp-txt-sub-det\">0.0</span>#ATAN2(90, 90) = <span class=\"ddp-txt-sub-det\">0.7853981633974483</span>#ATAN2(90, -90) = <span class=\"ddp-txt-sub-det\">2.356194490192345</span>","Obtain the arctangent value of the x and y coordinates specified in the radians from -Pi to Pi. However, the -Pi value is excluded.","x_num: The x coordinate of the point at which you want to obtain an angle.#y_num: the y-coordinate of the point where you want to obtain an angle.","ATAN2(90, 0) = <span class=\"ddp-txt-sub-det\">1.5707963267948966</span>#ATAN2(0, 90) = <span class=\"ddp-txt-sub-det\">0.0</span>#ATAN2(90, 90) = <span class=\"ddp-txt-sub-det\">0.7853981633974483</span>#ATAN2(90, -90) = <span class=\"ddp-txt-sub-det\">2.356194490192345</span>"
